"","","","","","","","","","",""
"","00000002451","33813-45600","33813-45600","MBS","Прокладка форсунки D4DD County/HD78, MBS","97.000","шт","40.00","",""
"","00000002119","20910-41D20","PFAM052","PARTS MALL","Прокладки ДВС D4AL HD72, PARTS MALL","3.000","компл.","1919.00","",""
"","00000000025","20910-41D20","PFA-M052","DYG KOREA","Прокладки ДВС D4AL HD72, DYG KOREA","5.000","компл.","2375.00","",""
"","00000002570","20910-41F00","2091041F00","RHEE JIN KOREA","Прокладки ДВС D4DB County, RHEE JIN KOREA","20.000","компл.","2280.00","",""
"","00000002572","20910-41H00","2091041H00","RHEE JIN KOREA","Прокладки ДВС D4DD HD65/78/County, RHEE JIN KOREA","8.000","компл.","2755.00","",""
"","00000005519","59825-5K210","59825-5K210","MBS","Пружина возвратная механизма тормозного HD65/72/78/County, MBS","1.000","шт","318.00","",""
"","ФР-00007199","22230-93000","22230-93000","MBS","Пружина клапана двигателя D4AL HD65/72/78, MBS","8.000","шт","49.00","",""
"","00000004448","59825-5H000","59825-5H000","MBS","Пружина колодок стояночного тормоза правая HD65/72/78/County, MBS","2.000","шт","123.00","",""
"","ФР-00007031","41414-45000","41414-45000","MBS","Пружина муфты сцепления D4AL HD72, MBS","2.000","шт","177.00","",""
"","00000004332","41414-5H510","41414-5H510","MBS","Пружина муфты сцепления D4DB/DB/GA HD65/72/78, MBS","2.000","шт","100.00","",""
"","ФР-00006581","43676-5H000","43676-5H000","MBS","Пружина рычага КПП County, MBS","2.000","шт","40.00","",""
"","ФР-00000556","QD41452-T00050","QD41452-T00050","MBS","Пружина синхронизатора КПП HD65/78/County, MBS","10.000","шт","21.00","",""
"","00000000725","58186-45000","58186-45000","MBS KOREA","Пружина тормозной колодки стяжная County/65/HD72/78, MBS KOREA","267.000","шт","95.00","",""
"","00000000726","58187-45000","58187-45000","MBS KOREA","Пружина тормозной колодок прижимная County/HD72, MBS KOREA","1010.000","шт","29.00","",""
"","00000002295","56828-5H000","56828-5H000","MBS","Пружина тяги рулевой продольной HD65/72/78/County, MBS","2.000","шт","812.00","",""
"","00000005477","41425-5H010","41425-5H010","MBS","Пыльник вилки сцепления D4AL/DB/DD, MBS","2.000","шт","251.00","",""
"","00000002072","41425-5H010","41425-5H010","MBS KOREA","Пыльник вилки сцепления D4AL/DB/DD, MBS KOREA","7.000","шт","252.00","",""
"","00000004347","56826-5H040","56826-5H040","MBS","Пыльник тяги рулевой продольной HD65/72/78/County, MBS","2.000","шт","168.00","",""
"","00000002496","97213-5H001","972135H001","DCC","Радиатор отопителя County/HD72/78, DCC","6.000","шт","1900.00","",""
"","ФР-00000191","97213-5H001","972135H001","DCC KOREA","Радиатор отопителя County/HD72/78, DCC KOREA","135.000","шт","1710.00","",""
"","00000006219","97216-5A200","972165A200","GEOPYUNG KOREA","Радиатор отопителя салона County, GEOPYUNG KOREA","169.000","шт","2090.00","",""
"","00000005007","25301-5H601","253015H601","SAMSUNG KOREA","Радиатор СОД D4AL/DB   County/HD72/78, SAMSUNG KOREA","27.000","шт","7125.00","",""
"","00000000790","25301-5H601","NDA-R125","HCC KOREA","Радиатор СОД D4AL/DB   County/HD72/78, HCC KOREA","36.000","шт","7125.00","",""
"","00000005731","25301-5A850","HC253015A850","HCC KOREA","Радиатор СОД D4DD County, HCC KOREA","14.000","шт","7410.00","",""
"","00000004492","25301-5K201","253015K201","HCC KOREA","Радиатор СОД D4DD ЕВРО-3 HD65/78, HCC KOREA","79.000","шт","6745.00","",""
"","00000003500","26740-45500","26740-45500","MBS","Распределитель масла D4DD, MBS","1.000","шт","1025.00","",""
"","ФР-00006399","37370-41750","KXAH-003","FYC KOREA","Регулятор напряжения генератора County, FYC KOREA","65.000","шт","665.00","",""
"","ФР-00006974","37370-45100","3737045100","FYC KOREA","Регулятор напряжения генератора D4AL HD72, FYC KOREA","29.000","шт","713.00","",""
"","00000000608","95235-5H000","95235-5H000","MBS KOREA","Реле County/72/78, MBS KOREA","1.000","шт","143.00","",""
"","ФР-00003002","36113-45500","36113-45500","MBS","Реле втягивающее D4DD HD65/78/County , MBS","1.000","шт","2717.00","",""
"","00000005363","36120-48100","36120-48100","MBS KOREA","Реле втягивающее D4GA/D6GA HD65/78/120/Богдан, MBS KOREA","1.000","шт","2375.00","",""
"","ФР-00001864","95550-45001","9555045001","FYC KOREA","Реле поворотов (3-х контактное) HD72 , FYC KOREA","41.000","шт","190.00","",""
"","ФР-00005085","95550-73001","9555073001","FYC KOREA","Реле поворотов HD72/78/County/120, FYC KOREA","168.000","шт","760.00","",""
"","00000000158","36120-41101","36120-41101","MBS KOREA","Реле свечей накала D4AL/DB County/HD72, MBS KOREA","4.000","шт","2280.00","",""
"","ФР-00005297","36155-45500","3615545500","OEM KOREA","Реле свечей накала D4DB/DD County/HD78, OEM KOREA","45.000","шт","1425.00","",""
"","00000001842","36155-45500","36155-45500","MBS KOREA","Реле свечей накала D4DB/DD County/HD78, MBS KOREA","1.000","шт","1520.00","",""
"","ФР-00005856","36155-48100","36155-48100","MBS KOREA","Реле стартера D4GA/D6GA HD65/78/120/Богдан, MBS KOREA","2.000","шт","1710.00","",""
"","ФР-00001310","36120-41000","3612041000","FYC KOREA","Реле стартера втягивающее D4AL/D4DB HD65/72/County , FYC KOREA","85.000","шт","1425.00","",""
"","00000000584","36120-41000","36120-41000","MBS KOREA","Реле стартера втягивающее D4AL/D4DB HD65/72/County , MBS KOREA","3.000","шт","1805.00","",""
"","00000000727","58301-45A00","58301-45A00","MBS KOREA","Рем. к-т рабочего тормозного цилиндра FR HD72 (передние), MBS KOREA","1176.000","компл.","176.00","",""
"","ФР-00000455","58301-45A00","58301-45A00","MBS","Рем. к-т рабочего тормозного цилиндра FR HD72 (передние), MBS","211.000","компл.","195.00","",""
"","00000000728","58301-45A11","58301-45A11","MBS KOREA","Рем. к-т рабочего тормозного цилиндра RR HD72 (задние), MBS KOREA","1263.000","компл.","162.00","",""
"","ФР-00002685","58301-45A11","58301-45A11","MBS","Рем. к-т рабочего тормозного цилиндра RR HD72 (задние), MBS","113.000","компл.","200.00","",""
"","ФР-00001121","58301-5KA00","58301-5KA00","MBS","Рем. к-т торм. цилиндра зад. County, MBS","71.000","компл.","171.00","",""
"","00000000763","58301-5KA00","58301-5KA00","MBS KOREA","Рем. к-т торм. цилиндра зад. County, MBS KOREA","619.000","компл.","171.00","",""
"","ФР-00003598","58301-5KA11","58301-5KA11","MBS","Рем. к-т торм. цилиндра перед. County, MBS","46.000","компл.","171.00","",""
"","00000000383","58301-5KA11","58301-5KA11","MBS KOREA","Рем. к-т торм. цилиндра перед. County, MBS KOREA","923.000","компл.","152.00","",""
"","ФР-00002445","25211-48160","8PK1020","DONGIL KOREA","Ремень вентилятора D4GA HD65/78/Богдан, DONGIL KOREA","90.000","шт","760.00","",""
"","ФР-00004026","25231-45002","CR2523145002","CR","Ремень генератора и насоса СОД 45.5 D4DD County/78 CR, CR","22.000","шт","190.00","",""
"","00000000886","25211-41712","A46,5","DONGIL KOREA","Ремень генератора и насоса СОД 46,5 D4AL HD72, DONGIL KOREA","58.000","шт","243.00","",""
"","ФР-00004027","25211-41712","CR2521141712","CR","Ремень генератора и насоса СОД 46,5 D4AL HD72 CR, CR","158.000","шт","181.00","",""
"","00000002934","25211-41702","A46.9","DONGIL KOREA","Ремень генератора и насоса СОД 46,9 D4AL County/HD72, DONGIL KOREA","227.000","шт","247.00","",""
"","00000000669","25212-41310","A24.6","DONGIL KOREA","Ремень ГУР А-24,6 County/HD72/78, DONGIL KOREA","72.000","шт","105.00","",""
"","ФР-00011344","25212-41310","25212-41310","MBS","Ремень ГУР А-24,6 County/HD72/78, MBS","1.000","шт","136.00","",""
"","00000006117","99134-5H001","A-60","DONGIL","Ремень кондиционера HD65/72/78, DONGIL","2.000","шт","285.00","",""
"","ФР-00005801","25210-48001","8PK1534","DONGIL KOREA","Ремень приводной D4GA HD65\78\Богдан, DONGIL KOREA","8.000","шт","808.00","",""
"","ФР-00005763","58501-5HA00","KOS-1105","KOS KOREA","Ремкомплект цилиндра тормозного главного HD65/72/78/County, KOS KOREA","1.000","шт","523.00","",""
"","ФР-00001680","58501-5HA10","585015HA10","KOS","Ремкомплект цилиндра тормозного главного HD65/72/78/County , KOS","1.000","шт","563.00","",""
"","00000002415","55100-5A300","CR551005A300","CR","Рессора задняя County CR, CR","25.000","шт","5700.00","",""
"","00000002416","54100-5A301","CR541005A301","CR","Рессора передняя County CR, CR","8.000","шт","4655.00","",""
"","00000001535","54100-5K500","541005K500","OEM","Рессора передняя с с/б HD72/78, OEM","3.000","шт","5510.00","",""
"","ФР-00008489","54110-5K500","541105K500","OEM","Рессора передняя с с/б HD72/78 CR, OEM","7.000","шт","5510.00","",""
"","ФР-00006249","24510-45002","2451045002","OEM","Рокер клапана HD78/County, OEM","4.000","шт","404.00","",""
"","00000003428","25216-52000","25216-52000","MBS KOREA","Ролик обводной приводного ремня D4GA D6GA HD65/78/120, MBS KOREA","9.000","шт","2280.00","",""
"","00000003775","25258-48000","25258-48000","MBS KOREA","Ролик приводного ремня D4GA HD65\78\Богдан, MBS KOREA","2.000","шт","4066.00","",""
"","ФР-00005799","25258-48000","2525848000","GATES KOREA","Ролик приводного ремня D4GA HD65\78\Богдан, GATES KOREA","15.000","шт","2565.00","",""
"","00000001902","25257-52000","25257-52000","MBS","Ролик приводного ремня натяжителя D4GA/D6GA HD65/72/78/Богдан, MBS","1.000","шт","3515.00","",""
"","00000003774","25257-52000","25257-52000","MBS KOREA","Ролик приводного ремня натяжителя D4GA/D6GA HD65/72/78/Богдан, MBS KOREA","4.000","шт","3610.00","",""
"","00000003773","25216-48000","25216-48000","MBS KOREA","Ролик ремня вентилятора обводной D4GA HD65/78/Богдан, MBS KOREA","11.000","шт","1642.00","",""
"","ФР-00006960","25216-48000","2521648000","GATES KOREA","Ролик ремня вентилятора обводной D4GA HD65/78/Богдан, GATES KOREA","4.000","шт","903.00","",""
"","00000002948","25216-48000","25216-48000","MBS","Ролик ремня вентилятора обводной D4GA HD65/78/Богдан, MBS","2.000","шт","1615.00","",""
"","00000006136","82310-5H001","82310-5H001","MBS","Ручка двери внутренняя левая HD72, MBS","3.000","шт","398.00","",""
"","00000001697","82320-5H001","82320-5H001","MBS KOREA","Ручка двери внутренняя правая HD72, MBS KOREA","1.000","шт","416.00","",""
"","ФР-00000554","82320-5H001","82320-5H001","MBS","Ручка двери внутренняя правая HD72, MBS","3.000","шт","416.00","",""
"","00000001495","82330-5H002","82330-5H002","MBS","Ручка двери наружная левая HD72, MBS","2.000","шт","665.00","",""
"","00000000423","82330-5H002","82330-5H002","MBS KOREA","Ручка двери наружная левая HD72, MBS KOREA","1.000","шт","523.00","",""
"","00000005011","56725-5K200","56725-5K200","MBS KOREA","Рычаг поворотного кулака левый D4DD HD78, MBS KOREA","1.000","шт","4465.00","",""
"","ФР-00012083","55783-5A300","55783-5A300","GEUN YOUNG","Сайлентблок заднего стабилизатора County, GEUN YOUNG","2.000","шт","178.00","",""
"","00000003515","54148-5A300","541485A300","SHINHWA KOREA","Сайлентблок рессоры County, SHINHWA KOREA","1642.000","шт","219.00","",""
"","ФР-00005206","54148-5A300","CR541485A300","CR","Сайлентблок рессоры County CR, CR","1457.000","шт","219.00","",""
"","00000002362","54148-5H050","541485H050","SHINHWA KOREA","Сайлентблок рессоры HD72/78, SHINHWA KOREA","809.000","шт","190.00","",""
"","ФР-00005208","54148-5H050","CR541485H050","CR","Сайлентблок рессоры HD72/78 CR, CR","421.000","шт","190.00","",""
"","ФР-00001287","21127-45001","KOS-086","KOS KOREA","Сальник коленвала задний (100х124х13) County/HD72/78, KOS KOREA","121.000","шт","333.00","",""
"","ФР-00002653","24717-41011","KOS-015","KOS KOREA","Сальник коленвала передний (55х78х12) HD72/78, KOS KOREA","79.000","шт","72.00","",""
"","00000000042","21321-45001","21321-45001","MBS KOREA","Сальник коленвала передний D4DB/D4DD HD72, MBS KOREA","1.000","шт","437.00","",""
"","00000001271","21321-45001","55*78*10*16,9","POS KOREA","Сальник коленвала передний D4DB/D4DD HD72, POS KOREA","112.000","шт","266.00","",""
"","ФР-00001288","21321-45001","KOS-082","KOS KOREA","Сальник коленвала передний D4DB/D4DD HD72, KOS KOREA","34.000","шт","266.00","",""
"","ФР-00000374","21321-45001","2132145001","POS","Сальник коленвала передний D4DB/D4DD HD72, POS","39.000","шт","266.00","",""
"","ФР-00001824","21719-52000","21719-52000","MBS KOREA","Сальник коленвала передний D4GA/D6GA HD65/78/120/Bogdan , MBS KOREA","2.000","шт","342.00","",""
"","00000000186","43155-45000","43155-45000","MBS KOREA","Сальник МКПП вала вторичного (48х65х9) HD72, MBS KOREA","3.000","шт","285.00","",""
"","00000001518","QD43155-T00080","QD43155-T00080","MBS KOREA","Сальник МКПП вала вторичного (50х65х9) HD72/78/County (M035S5), MBS KOREA","4.000","шт","523.00","",""
"","ФР-00006977","43155-5H000","431555H000","POS KOREA","Сальник МКПП вала вторичного (50х65х9) HD72/78/County (M035S5), POS KOREA","34.000","шт","91.00","",""
"","00000003803","QD43113-T00180","QD43113-T00180","MBS","Сальник МКПП вала первичного (40х58х8) County/78 D4DD, MBS","2.000","шт","118.00","",""
"","00000000184","43113-P06020","KOS-508","HOS KOREA","Сальник МКПП вала первичного (40х58х8) County/78 D4DD, HOS KOREA","82.000","шт","76.00","",""
"","ФР-00001274","QD43113-T00020","QD43113-T00020","MBS KOREA","Сальник МКПП вала первичного HD65/72/County, MBS KOREA","11.000","шт","114.00","",""
"","ФР-00006938","21124-45001","2112445001","POS KOREA","Сальник подшипника коленвала (флажок) HD72, POS KOREA","191.000","шт","53.00","",""
"","ФР-00003739","53352-45010","1411ABNAH0 ","POS KOREA","Сальник редуктора (хвостовика) заднего моста (52х84х14) HD72, POS KOREA","1.000","шт","76.00","",""
"","00000001427","53352-5H000","533525H000","POS KOREA","Сальник редуктора (хвостовика) заднего моста (56х99х33,2) County/HD78, POS KOREA","43.000","шт","219.00","",""
"","ФР-00001866","53352-5H650","811AWH1","POS KOREA","Сальник редуктора (хвостовика) заднего моста (56х99х33,2) County/HD78, POS KOREA","48.000","шт","219.00","",""
"","00000005875","52810-45000","1411ABNAB0 ","POS","Сальник ступицы задний внутренний (70х112х10) County/HD65, POS","3.000","шт","82.00","",""
"","00000000754","52810-45000","1411ABNAB0      ","POS KOREA","Сальник ступицы задний внутренний (70х112х10) County/HD65, POS KOREA","877.000","шт","58.00","",""
"","ФР-00001066","52810-45210","52810-45210","MBS","Сальник ступицы задний внутренний (80х122х10) HD72/78, MBS","14.000","шт","144.00","",""
"","00000000264","52810-5K000","52810-5K000","MBS KOREA","Сальник ступицы задний внутренний (80х122х10) HD72/78, MBS KOREA","13.000","шт","760.00","",""
"","00000000958","52810-45210","1411ABNAB1    ","POS KOREA","Сальник ступицы задний внутренний (80х122х10) HD72/78, POS KOREA","909.000","шт","110.00","",""
"","00000005789","52820-45210","52820-45210","MBS","Сальник ступицы задний наружний  (52х112х10,5) HD72/78, MBS","19.000","шт","144.00","",""
"","00000000959","52820-45210","5282045210","POS KOREA","Сальник ступицы задний наружний  (52х112х10,5) HD72/78, POS KOREA","632.000","шт","103.00","",""
"","ФР-00001695","52820-45000","52820-45000","MBS","Сальник ступицы задний наружний (46х102х10,5) County/HD65, MBS","51.000","шт","153.00","",""
"","00000004594","52820-45000","5282045000","POS","Сальник ступицы задний наружний (46х102х10,5) County/HD65, POS","731.000","шт","88.00","",""
"","ФР-00004690","52820-5K000","KOS-437","KOS KOREA","Сальник ступицы задний наружний Евро-3 (52х102х10,5) HD65/County, KOS KOREA","223.000","шт","285.00","",""
"","00000004403","51830-45000","51830-45000","MBS","Сальник ступицы передний (68х90х12) County/HD65, MBS","24.000","шт","100.00","",""
"","00000001664","51830-45000","5183045000","POS KOREA","Сальник ступицы передний (68х90х12) County/HD65, POS KOREA","1036.000","шт","45.00","",""
"","00000005486","51830-45000","5183045000","POS","Сальник ступицы передний (68х90х12) County/HD65, POS","2.000","шт","57.00","",""
"","00000000245","51830-45200","51830-45200","MBS KOREA","Сальник ступицы передний (72х94х8) HD72/78/Fuso Canter, MBS KOREA","1.000","шт","124.00","",""
"","ФР-00001440","51830-45200","51830-45200","MBS","Сальник ступицы передний (72х94х8) HD72/78/Fuso Canter, MBS","87.000","шт","113.00","",""
"","00000001140","36710-45001","36710-45001","MBS KOREA","Свеча накаливания County/HD72/78, MBS KOREA","4.000","шт","570.00","",""
"","00000003516","36710-45001","3671045001","JIN YOU KOREA","Свеча накаливания County/HD72/78, JIN YOU KOREA","503.000","шт","428.00","",""
"","00000001342","22112-41011","22112-41011","MBS KOREA","Седло впускного клапана D4AL/DB County/HD72, MBS KOREA","39.000","шт","86.00","",""
"","00000001343","22113-41021","22113-41021","MBS KOREA","Седло выпускного клапана D4AL/DB County/HD72, MBS KOREA","1.000","шт","44.00","",""
"","00000005515","22222-93000","22222-93000","MBS","Седло клапана HD65/72/78/120/County, MBS","12.000","шт","76.00","",""
"","ФР-00008861","22112-52900","22112-52900","MBS KOREA","Седло клапана впускного D4GA/D6GA  HD65/78/120/Богдан, MBS KOREA","8.000","шт","238.00","",""
"","ФР-00001825","22112-52000","22112-52000","MBS KOREA","Седло клапана впускного D4GA/D6GA  HD65/78/120/Богдан, MBS KOREA","8.000","шт","143.00","",""
"","00000002556","58189-45000","58189-45000","MBS KOREA","Седло пружины солдатика HD65/72/78/County, MBS KOREA","718.000","шт","19.00","",""
"","00000002795","58189-45000","58189-45000","MBS","Седло пружины солдатика HD65/72/78/County, MBS","10.000","шт","20.00","",""
"","ФР-00008589","54230-46050","5423046050","TYB","Серьга крепления рессоры передней/задней (в сборе с гайками и пластиной) County, TYB","19.000","шт","665.00","",""
"","00000003814","54230-46050","54230-46050","MBS","Серьга крепления рессоры передней/задней County, MBS","1.000","шт","667.00","",""
"","00000003498","55230-45003","55230-45003","MBS","Серьга рессоры задней HD65/72/78, MBS","20.000","шт","765.00","",""
"","ФР-00001517","54230-5L000","54230-5L000","MBS","Серьга рессоры передняя HD65/72/78, MBS","1.000","шт","706.00","",""
"","ФР-00000392","54230-45001","54230-45001","MBS","Серьга рессоры передняя HD72, MBS","13.000","шт","931.00","",""
"","00000004307","96620-7A000","966207A000","SKY/SUNG IL KOREA","Сигнал звуковой 24V HD72/78, SKY/SUNG IL KOREA","7.000","шт","618.00","",""
"","00000001917","QH17013-25H810A","QH17013-25H810A","MBS","Синхронизатор КПП HD65/78, MBS","1.000","шт","9290.00","",""
"","00000004286","58188-45200","58188-45200","MBS KOREA","Солдатик тормозной колодки HD65/72/78, MBS KOREA","350.000","шт","27.00","",""
"","00000001125","94111-5H500","94111-5H500","MBS KOREA","Спидометр HD65/72/78/County, MBS KOREA","9.000","шт","1995.00","",""
"","00000000890","36100-41012","S1021","VALEO KOREA","Стартер D4AL/DB County/HD72, VALEO KOREA","21.000","шт","9215.00","",""
"","00000000892","36100-45501","S1029","VALEO KOREA","Стартер D4DD (11зубьев) County/HD78, VALEO KOREA","29.000","шт","16150.00","",""
"","ФР-00005857","36100-48100","36100-48100","MBS KOREA","Стартер D4GA/D6GA HD65/78/120/Богдан, MBS KOREA","1.000","шт","19000.00","",""
"","00000001179","86111-5A300","861115A300","KMK GLASS","Стекло ветровое (с защит. полосой) County, KMK GLASS","14.000","шт","3088.00","",""
"","00000001180","86111-5H010","861115H010","KMK GLASS","Стекло ветровое (с защит. полосой) HD65/72/78, KMK GLASS","24.000","шт","2964.00","",""
"","00000001888","81511-5H000","815115H000","KMK GLASS","Стекло двери левой HD65/72/78, KMK GLASS","9.000","шт","1188.00","",""
"","00000001889","81521-5H010","815215H010","KMK GLASS","Стекло двери правой HD65/72/78, KMK GLASS","7.000","шт","1188.00","",""
"","00000004863","94117-5H000","94117-5H000","MBS","Стекло щитка приборов HD72, MBS","1.000","шт","280.00","",""
"","00000001669","54791-5A300","54791-5A300","MBS KOREA","Стойка переднего стабилизатора County, MBS KOREA","3.000","шт","285.00","",""
"","ФР-00007245","14611-05001","14611-05001","MBS","Стопорное кольцо педали акселератора (газа) HD72, MBS","8.000","шт","8.00","",""
"","ФР-00004608","55225-5H600AS","CR552255H600AS","CR","Стремянка крепления задней рессоры County (с гайками), CR","25.000","компл.","300.00","",""
"","ФР-00004607","55225-5K500","CR552255K500","CR","Стремянка крепления задней рессоры HD65/72/78  (с гайками), CR","34.000","компл.","333.00","",""
"","ФР-00005349","55225-5K500","CR552255K500-10","CR","Стремянка крепления задней рессоры удлиненная HD65/72/78 (с гайками), CR","173.000","компл.","361.00","",""
"","ФР-00004455","54225-5H901","CR542255H901","CR","Стремянка крепления передней рессоры HD65/72/78 (с гайками), CR","73.000","компл.","257.00","",""
"","ФР-00004458","54225-5A200","CR542255A200","CR","Стремянка крепления передней рессоры удлиненная County/NPR/NQR75/71 (с гайками), CR","142.000","компл.","285.00","",""
"","00000006266","22223-93001","22223-93001","MBS","Сухарь клапана  D4AL/DD/DB HD72, MBS","15.000","шт","17.00","",""
"","00000000554","22223-93001","22223-93001","MBS KOREA","Сухарь клапана  D4AL/DD/DB HD72, MBS KOREA","38.000","шт","17.00","",""
"","00000002338","VKD80017","VKD80017","VALEO KOREA","Сцепление к-т (без выжимного) D4AL HD72, VALEO KOREA","2.000","компл.","5415.00","",""
"","ФР-00007023","HDK187","HDK187","VALEO KOREA","Сцепление к-т (диск+корзина+подшипник) D4DB/DD County/HD78, VALEO KOREA","53.000","компл.","10450.00","",""
"","ФР-00001320","26420-48000","2642048000","SAMSUNG KOREA","Теплообменник-маслоохладитель (радиатор масляный) D4GA HD65/78/Богдан, SAMSUNG KOREA","7.000","шт","4275.00","",""
"","00000001281","26410-41013","2641041013","SAMSUNG KOREA","Теплообменник-маслоохладитель HD72, SAMSUNG KOREA","2.000","шт","5605.00","",""
"","ФР-00005291","25510-41010","2551041010","SHAP KOREA","Термостат County/HD72/78, SHAP KOREA","19.000","шт","523.00","",""
"","ФР-00005292","25510-41020","2551041020","SHAP KOREA","Термостат County/HD72/78 (82*), SHAP KOREA","38.000","шт","523.00","",""
"","ФР-00006962","25510-52010","2551052010","SHAP KOREA","Термостат D4GA/D6GA  HD65/78/120/БОГДАН, SHAP KOREA","10.000","шт","760.00","",""
