"","","","","","","","","","",""
"","ФР-00002446","25213-84401","10PK1088","DONGIL KOREA","Ремень вентилятора D6CB38 HD170, DONGIL KOREA","20.000","шт","475.00","",""
"","00000000658","0K87T-18381","B52.3","DONGIL KOREA","Ремень генератор-помпа HD120, DONGIL KOREA","61.000","шт","371.00","",""
"","00000002852","25212-83000","25212-83000","MBS","Ремень генератора HD170,250,260,270,450 дв.D6AC/ABDD/AV, MBS","1.000","шт","504.00","",""
"","00000002860","57178-93000","57178-93000","MBS","Ремень гидроусилителя D6BR HD120, MBS","3.000","шт","190.00","",""
"","00000002875","25210-84401","25210-84401","MBS KOREA","Ремень насоса СОД D6CB38 HD170, MBS KOREA","3.000","шт","1473.00","",""
"","00000006124","55100-6C000","CR551006C000","CR","Рессора задняя HD120 CR, CR","47.000","шт","10450.00","",""
"","ФР-00005227","54100-6A010","CR541006A010","CR","Рессора передняя левая (7 листов/с пальцем) HD120 CR, CR","56.000","шт","7030.00","",""
"","ФР-00004746","54110-6A010","CR541106A010","CR","Рессора передняя правая (7 листов/с пальцем) HD120 CR, CR","90.000","шт","7030.00","",""
"","00000000505","0K850-12130A","0K850-12130A","MBS KOREA","Рокер впускного клапана HD120 D6DA, MBS KOREA","1.000","шт","181.00","",""
"","00000001051","0K850-12150A","0K850-12150A","MBS KOREA","Рокер выпускного клапана HD120 D6DA, MBS KOREA","10.000","шт","181.00","",""
"","ФР-00000371","82310-7A002","82310-7A002","MBS","Ручка двери внутренняя левая HD120/170/250/450, MBS","3.000","шт","218.00","",""
"","ФР-00000516","82320-7A002","82320-7A002","MBS","Ручка двери внутренняя правая HD120/170/450, MBS","2.000","шт","208.00","",""
"","ФР-00002120","0K850-10599A","0K850-10599A","MBS","Сальник коленвала задний (106х126х12) D6DA19/22 HD120, MBS","4.000","шт","230.00","",""
"","00000001050","0K850-10602","0K850-10602","MBS KOREA","Сальник коленвала передний HD120 D6DA19/D6DA22, MBS KOREA","8.000","шт","60.00","",""
"","ФР-00011038","0K850-10602","0K850-10602","MBS","Сальник коленвала передний HD120 D6DA19/D6DA22, MBS","2.000","шт","49.00","",""
"","ФР-00004876","QWGK87V-172090","QWGK87V-172090","MBS KOREA","Сальник МКПП  вала первичного (KH10) HD120, MBS KOREA","1.000","шт","133.00","",""
"","00000002681","QW43192-6A340","QW43192-6A340","MBS KOREA","Сальник МКПП вала вторичного (KH10) HD120, MBS KOREA","7.000","шт","475.00","",""
"","00000004196","QW43113-6A340","QW43113-6A340","MBS","Сальник МКПП вала первичного (KH10) HD120, MBS","4.000","шт","105.00","",""
"","00000000286","53352-55011","5335255011","HOS KOREA","Сальник редуктора (хвостовика) заднего моста (60x103x9) HD120, HOS KOREA","140.000","шт","333.00","",""
"","00000000265","52810-73501","5281073501","HOS KOREA","Сальник ступицы задний внутренний (130х150х13) HD120, HOS KOREA","70.000","шт","133.00","",""
"","ФР-00008148","52820-62200","KOS-513","KOS KOREA","Сальник ступицы задний наружний  (57х121х17) HD120, KOS KOREA","93.000","шт","238.00","",""
"","00000000271","52820-62200","KOS-513","HOS KOREA","Сальник ступицы задний наружний  (57х121х17) HD120, HOS KOREA","170.000","шт","238.00","",""
"","ФР-00008146","51830-62000","KOS-506","KOS KOREA","Сальник ступицы передний (102х116х14) HD120, KOS KOREA","1.000","шт","67.00","",""
"","00000000247","51830-62000","KOS-506","HOS KOREA","Сальник ступицы передний (102х116х14) HD120, HOS KOREA","163.000","шт","67.00","",""
"","00000005203","86111-7A000","861117A000","KMK GLASS","Стекло ветровое ( с защитной полосой) HD160/170/260/270/450/500 , KMK GLASS","2.000","шт","3183.00","",""
"","00000001181","86111-6A000","861116A000","KMK GLASS","Стекло ветровое (с защит. полосой) HD120, KMK GLASS","2.000","шт","3183.00","",""
"","00000002267","81511-7A012","815117A012","KMK GLASS","Стекло двери левой HD120, KMK GLASS","2.000","шт","1140.00","",""
"","00000002268","81521-7A012","815217A012","KMK GLASS","Стекло двери правой HD120/160/170/260/270/450/500 , KMK GLASS","1.000","шт","1254.00","",""
"","ФР-00006230","55225-69010","CR5522569010","CR","Стремянка крепления задней рессоры HD160/HD170/HD450/HD500/HD600 (с гайками), CR","21.000","компл.","808.00","",""
"","ФР-00000670","55225-74001","CR5522574001","CR","Стремянка крепления задней рессоры HD250/HD260/HD270/HD350 (с гайками), CR","1.000","компл.","950.00","",""
"","ФР-00004779","54225-62073AS","CR5422562073AS","CR","Стремянка крепления передней рессоры HD120 (с гайками), CR","60.000","компл.","285.00","",""
"","00000006102","54225-62074","54225-62074","MBS","Стремянка крепления рессоры передней (3 листа) D6GA HD120 , MBS","1.000","шт","808.00","",""
"","ФР-00008263","54225-67011","54225-67011","MBS","Стремянка рессоры передней HD160/H70/450/500/600 , MBS","1.000","шт","736.00","",""
"","ФР-00009265","QW43380-6A340","QW43380-6A340","MBS","Ступица  кпп синхронизатора HD120, MBS","1.000","шт","1099.00","",""
"","00000001822","52752-6A200","52752-6A200","MBS KOREA","Ступица задняя (пневмотормоза) HD120, MBS KOREA","6.000","шт","1900.00","",""
"","ФР-00006963","25510-72410","2551072410","SHAP KOREA","Термостат D6BR HD120, SHAP KOREA","4.000","шт","570.00","",""
"","ФР-00007323","0K850-15171A","0K85015171A","SHAP KOREA","Термостат HD120, SHAP KOREA","1.000","шт","608.00","",""
"","00000001282","0K850-15171A","0K850-15171A","MBS KOREA","Термостат HD120, MBS KOREA","5.000","шт","665.00","",""
"","00000001887","84740-6B000","84740-6B000","MBS KOREA","Торпеда HD120, MBS KOREA","1.000","шт","4275.00","",""
"","ФР-00006972","32770-6A001","327706A001","INFAC KOREA","Трос газа ручного HD120/160/170/450, INFAC KOREA","11.000","шт","228.00","",""
"","00000000211","43750-6A251","43750-6A251","MBS KOREA","Трос МКПП включения заднего хода D6DA19 HD120, MBS KOREA","1.000","шт","1900.00","",""
"","ФР-00006980","43750-6A251","437506A251","INFAC KOREA","Трос МКПП включения заднего хода D6DA19 HD120, INFAC KOREA","13.000","шт","1568.00","",""
"","00000000210","43750-6A201","43750-6A201","MBS KOREA","Трос МКПП включения заднего хода D6DA22 HD120, MBS KOREA","1.000","шт","2280.00","",""
"","ФР-00008578","43750-6A201","437506A201","INFAC KOREA","Трос МКПП включения заднего хода D6DA22 HD120, INFAC KOREA","6.000","шт","1900.00","",""
"","00000004280","43740-6A250","437406A250","INFAC KOREA","Трос МКПП переключения передач D6DA19 HD120, INFAC KOREA","39.000","шт","1710.00","",""
"","ФР-00001315","43740-6A200","437406A200","INFAC KOREA","Трос МКПП переключения передач D6DA22 HD120, INFAC KOREA","50.000","шт","1758.00","",""
"","00000000207","43740-6A200","43740-6A200","MBS KOREA","Трос МКПП переключения передач D6DA22 HD120, MBS KOREA","1.000","шт","2660.00","",""
"","ФР-00007002","59910-6A003","599106A003","INFAC KOREA","Трос стояночного тормоза HD120, INFAC KOREA","1.000","шт","950.00","",""
"","00000003402","28720-6A701","28720-6A701","MBS KOREA","Труба выхлопная передняя D6DA19 HD120, MBS KOREA","2.000","шт","1615.00","",""
"","00000002046","41821-6A004","41821-6A004","MBS","Трубка главного цилиндра сцепления HD120, MBS","1.000","шт","168.00","",""
"","ФР-00004865","56871-6C900","56871-6C900","MBS","Тяга рулевая  поперечная D6GA HD120, MBS","1.000","шт","4947.00","",""
"","00000006100","56871-6A000","56871-6A000","MBS","Тяга рулевая поперечная HD120, MBS","1.000","шт","3520.00","",""
"","00000003784","56810-6B011","56810-6B011","MBS KOREA","Тяга рулевая продольная в сборе HD120, MBS KOREA","3.000","шт","9500.00","",""
"","00000000969","56810-6A001","56810-6A001","MBS KOREA","Тяга рулевая продольная в сборе HD120, MBS KOREA","1.000","шт","4940.00","",""
"","00000001117","92301-6A100","92301-6A100","MBS KOREA","Указатель поворота левый HD120, MBS KOREA","2.000","шт","1140.00","",""
"","00000002952","92302-6B100","92302-6B100","MBS KOREA","Указатель поворота правый HD120, MBS KOREA","1.000","шт","1520.00","",""
"","00000002013","92302-6A002","92302-6A002","MBS KOREA","Указатель поворота правый HD120, MBS KOREA","7.000","шт","950.00","",""
"","00000001119","92302-6A100","92302-6A100","MBS KOREA","Указатель поворота правый HD120, MBS KOREA","1.000","шт","1167.00","",""
"","00000000933","QW41700-6A201","QW41700-6A201","MBS KOREA","Усилитель сцепления вакуумный  (ПГУ) HD120, MBS KOREA","16.000","шт","14250.00","",""
"","ФР-00008230","92101-7A101","CR921017A101","CR","Фара левая (без ламп) HD170, CR","8.000","шт","2850.00","",""
"","00000000603","92101-7A101","92101-7A101","MBS KOREA","Фара левая HD170, MBS KOREA","1.000","шт","3420.00","",""
"","ФР-00008231","92102-7A101","CR921027A101","CR","Фара правая (без ламп) HD170, CR","8.000","шт","2850.00","",""
"","00000000848","92102-7A101","92102-7A101","MBS KOREA","Фара правая HD170, MBS KOREA","1.000","шт","4750.00","",""
"","ФР-00008241","92202-7C000","CR922027C000","CR","Фара противотуманная  правая HD160/170/260/270/500 , CR","3.000","шт","1900.00","",""
"","00000001116","92201-6A000","92201-6A000","MBS KOREA","Фара противотуманная левая HD120, MBS KOREA","7.000","шт","2565.00","",""
"","ФР-00008239","92201-7A100","CR922017A100","CR","Фара противотуманная левая HD160/170/260/270/450, CR","8.000","шт","855.00","",""
"","ФР-00008240","92201-7C000","CR922017C000","CR","Фара противотуманная левая HD160/170/260/270/500 , CR","2.000","шт","1900.00","",""
"","00000003791","92202-6B000","92202-6B000","MBS KOREA","Фара противотуманная правая HD120, MBS KOREA","1.000","шт","2850.00","",""
"","00000001318","92202-6A000","92202-6A000","MBS KOREA","Фара противотуманная правая HD120, MBS KOREA","6.000","шт","2090.00","",""
"","ФР-00008238","92202-7A100","CR922027A100","CR","Фара противотуманная правая HD160/170/260/270/450, CR","9.000","шт","855.00","",""
"","ФР-00008197","14913-05000","14913-05000","MBS","Фиксатор внутренней панели кузова, MBS","5.000","шт","14.00","",""
"","00000002662","28130-69014","JA-H67","JHF KOREA","Фильтр воздушный D6AC/ABDD/AV, JHF KOREA","21.000","шт","1425.00","",""
"","00000000013","28130-7C000","JA-H75","JHF KOREA","Фильтр воздушный D6AC/ABDD/AV, JHF KOREA","13.000","шт","2470.00","",""
"","ФР-00006155","28130-7C000","CR281307C000","CR","Фильтр воздушный D6AC/ABDD/AV, CR","16.000","шт","1568.00","",""
"","ФР-00007335","28130-6A010","JA-H103","JHF KOREA","Фильтр воздушный D6BR HD120 , JHF KOREA","17.000","шт","1045.00","",""
"","00000000014","28130-8D000","JA-H92","JHF KOREA","Фильтр воздушный D6CB (445х335х195) Universe, JHF KOREA","96.000","шт","2850.00","",""
"","00000000012","28130-6A701","JA-H66","JHF KOREA","Фильтр воздушный D6DA19/22 HD120, JHF KOREA","61.000","шт","1045.00","",""
"","ФР-00006537","28130-6B110","CR281306B110","CR","Фильтр воздушный D6GA HD120, CR","35.000","шт","1188.00","",""
"","ФР-00001859","28130-6B110","JA-H74","JHF KOREA","Фильтр воздушный D6GA HD120, JHF KOREA","76.000","шт","1568.00","",""
"","ФР-00006965","28130-7G200","JA-H77","JHF KOREA","Фильтр воздушный внешний HD260/270/370/500, JHF KOREA","9.000","шт","950.00","",""
"","ФР-00005490","28130-7G210","28130-7G210","MBS","Фильтр воздушный внутренний HD260/270/370/500, MBS","4.000","шт","656.00","",""
"","00000002635","97164-7A000","97164-7A000","MBS KOREA","Фильтр воздушный салона (сетка) HD120, MBS KOREA","1.000","шт","276.00","",""
"","ФР-00009260","26325-83900","JO-H06  ","JHF","Фильтр масляный D6AC/AV/ABDD (комплект), JHF","9.000","компл.","789.00","",""
"","00000000879","26325-83000","JO-H06","JHF KOREA","Фильтр масляный D6AC/AV/ABDD (комплект), JHF KOREA","3.000","компл.","713.00","",""
"","00000000881","26452-72001","JO-H10","JHF KOREA","Фильтр масляный D6AZ, JHF KOREA","54.000","шт","380.00","",""
"","ФР-00003552","26316-93000","JO-327","JHF KOREA","Фильтр масляный D6BR HD120/AeroTown, JHF KOREA","54.000","шт","423.00","",""
"","00000001567","26325-84001","JO-H09","JHF KOREA","Фильтр масляный D6CA/CB, JHF KOREA","3.000","шт","452.00","",""
"","ФР-00011950","26325-84001"," PBA-018","PARTS MALL","Фильтр масляный D6CA/CB, PARTS MALL","85.000","шт","371.00","",""
"","00000000880","26345-84001","JO-H07","JHF KOREA","Фильтр масляный D6CA/CB, JHF KOREA","58.000","шт","380.00","",""
"","00000000003","0K87A-14317","JC-H08","JHF KOREA","Фильтр масляный HD120, JHF KOREA","231.000","шт","950.00","",""
"","ФР-00002667","97163-7C001","JAC-H68","JHF KOREA","Фильтр салонный HD160/170/260/270, JHF KOREA","7.000","шт","380.00","",""
"","ФР-00001272","97163-7C001","97163-7C001","MBS KOREA","Фильтр салонный HD160/170/260/270, MBS KOREA","1.000","шт","855.00","",""
"","ФР-00004688","31950-93001","JHC-H14","JHF KOREA","Фильтр топливный D6BR HD120, JHF KOREA","128.000","шт","238.00","",""
"","00000000884","31945-84400","JFC-H49","JHF KOREA","Фильтр топливный D6CB, JHF KOREA","48.000","шт","523.00","",""
"","ФР-00006751","31945-82000","JFC-H49","JHF KOREA","Фильтр топливный D6HA/D6CC38 HD500/Universe Space/Xpress, JHF KOREA","5.000","шт","665.00","",""
"","00000000017","31945-8Y000","JFC-H08","JHF KOREA","Фильтр топливный HD120, JHF KOREA","93.000","шт","219.00","",""
"","ФР-00003457","31940-8Y000","31940-8Y000","MBS","Фильтр топливный HD120/Aerotown дв.D6DA19/22 в сборе , MBS","1.000","шт","1425.00","",""
"","ФР-00008617","59553-69010A","4324102227","OEM","Фильтр-патрон осушителя воздуха  HD120 , OEM","1.000","шт","665.00","",""
"","00000001863","59553-69010A","59553-69010A","MBS KOREA","Фильтр-патрон осушителя воздуха (WABCO) HD120, MBS KOREA","1.000","шт","1995.00","",""
"","ФР-00006861","59553-69010A","AL12","MAHLE","Фильтр-патрон осушителя воздуха (WABCO) HD120 , MAHLE","3.000","шт","1012.00","",""
"","ФР-00001552","41600-7D001","KAC0751","TCIC","Цилиндр сцепления главный HD120, TCIC","1.000","шт","1148.00","",""
"","00000001622","59110-6A003","59110-6A003","MBS KOREA","Цилиндр тормозной главный с усилителем HD120, MBS KOREA","4.000","шт","11875.00","",""
"","00000003263","58350-62004","58350-62004","MBS KOREA","Цилиндр тормозной заднего левого колеса (с прокачкой) HD120, MBS KOREA","2.000","шт","2886.00","",""
"","00000000392","58350-62004","11R0527","TCIC KOREA","Цилиндр тормозной заднего левого колеса (с прокачкой) HD120, TCIC KOREA","11.000","шт","2375.00","",""
"","ФР-00006492","58350-62004","CR5835062004","CR","Цилиндр тормозной заднего левого колеса (с прокачкой) HD120, CR","83.000","шт","1520.00","",""
"","00000000388","58330-62004","58330-62004","MBS KOREA","Цилиндр тормозной заднего левого колеса HD120, MBS KOREA","13.000","шт","3135.00","",""
"","00000000389","58330-62004","11S0521","TCIC KOREA","Цилиндр тормозной заднего левого колеса HD120, TCIC KOREA","17.000","шт","2375.00","",""
"","ФР-00006479","58330-62004","CR5833062004","CR","Цилиндр тормозной заднего левого колеса HD120, CR","78.000","шт","1520.00","",""
"","00000000398","58450-62004","11T0526","TCIC KOREA","Цилиндр тормозной заднего правого колеса (с прокачкой) HD120, TCIC KOREA","25.000","шт","1995.00","",""
"","ФР-00006480","58450-62004","CR5845062004","CR","Цилиндр тормозной заднего правого колеса (с прокачкой) HD120, CR","72.000","шт","1520.00","",""
"","00000000396","58430-62004","11U0520","TCIC KOREA","Цилиндр тормозной заднего правого колеса HD120, TCIC KOREA","3.000","шт","2375.00","",""
"","00000000395","58430-62004","58430-62004","MBS KOREA","Цилиндр тормозной заднего правого колеса HD120, MBS KOREA","2.000","шт","2945.00","",""
"","ФР-00006481","58430-62004","CR5843062004","CR","Цилиндр тормозной заднего правого колеса HD120, CR","73.000","шт","1520.00","",""
"","ФР-00006482","58150-62003","CR5815062003","CR","Цилиндр тормозной переднего левого колеса (с прокачкой) HD120, CR","82.000","шт","1520.00","",""
"","00000001861","58150-62003","58150-62003","MBS KOREA","Цилиндр тормозной переднего левого колеса (с прокачкой) HD120, MBS KOREA","1.000","шт","2660.00","",""
"","00000000375","58150-62003","11F0522","TCIC KOREA","Цилиндр тормозной переднего левого колеса (с прокачкой) HD120, TCIC KOREA","6.000","шт","1995.00","",""
"","ФР-00006483","58130-62003","CR5813062003","CR","Цилиндр тормозной переднего левого колеса HD120, CR","79.000","шт","1520.00","",""
"","00000001860","58130-62003","58130-62003","MBS KOREA","Цилиндр тормозной переднего левого колеса HD120, MBS KOREA","5.000","шт","2280.00","",""
"","00000000373","58130-62003","11G0527","TCIC KOREA","Цилиндр тормозной переднего левого колеса HD120, TCIC KOREA","9.000","шт","1995.00","",""
"","ФР-00006478","58230-62004","CR5823062004","CR","Цилиндр тормозной переднего правого колеса HD120, CR","78.000","шт","1520.00","",""
"","ФР-00006493","58250-62003","CR5825062003","CR","Цилиндр тормозной переднего правого колеса HD120, CR","76.000","шт","1520.00","",""
"","00000001862","58250-62003","58250-62003","MBS KOREA","Цилиндр тормозной переднего правого колеса HD120, MBS KOREA","1.000","шт","2280.00","",""
"","00000000380","58230-62004","11I0526","TCIC KOREA","Цилиндр тормозной переднего правого колеса HD120, TCIC KOREA","5.000","шт","1995.00","",""
"","ФР-00000603","13602-12003","13602-12003","MBS KOREA","Шайба амортизатора кабины HD120, MBS KOREA","32.000","шт","8.00","",""
"","ФР-00003099","13602-12003","13602-12003","MBS","Шайба амортизатора кабины HD120 , MBS","4.000","шт","11.00","",""
"","ФР-00001110","54241-62002","54241-62002","MBS","Шайба пальца рессоры HD120/AeroTown, MBS","10.000","шт","69.00","",""
"","00000002565","0K87T-11210","0K87T-11210","MBS KOREA","Шатун D6DA19/22 HD120, MBS KOREA","2.000","шт","1900.00","",""
"","ФР-00006450","QW43531-6A340","QW43531-6A340","MBS KOREA","Шестерня привода спидометра ведущая D6DA22 HD120, MBS KOREA","1.000","шт","1235.00","",""
"","00000005833","K56771-62001","K56771-62001","MBS","Шкворень в сборе ф35 HD120, MBS","4.000","компл.","4180.00","",""
"","00000000474","K56771-62001","K5677162001","NAM YANG KOREA","Шкворень в сборе ф35 HD120, NAM YANG KOREA","17.000","компл.","2565.00","",""
"","ФР-00006885","K56771-62001","CRK5677162001","CR","Шкворень в сборе ф35 HD120, CR","46.000","компл.","2138.00","",""
"","ФР-00002405","52775-6A200","527756A200","TAE YANG KOREA","Шпилька задняя правая HD120 (т-образная), TAE YANG KOREA","78.000","компл.","352.00","",""
"","00000000824","51755-92300","5175592300","TAE YANG KOREA","Шпилька колеса передняя левая HD120/AeroTown, TAE YANG KOREA","8.000","компл.","285.00","",""
"","00000000827","51775-6A500","517756A500","TAE YANG KOREA","Шпилька передняя правая (в сборе) HD120, TAE YANG KOREA","50.000","компл.","295.00","",""
"","00000000828","51775-92300","5177592300","TAE YANG KOREA","Шпилька передняя правая HD120, TAE YANG KOREA","14.000","компл.","266.00","",""
"","00000002564","0K87A-12310","0K87A-12310","MBS KOREA","Штанга толкателя D6DA19/22 HD120, MBS KOREA","8.000","шт","95.00","",""
"","00000003610","54247-67001","54247-67001","MBS","Штуцер пальца рессоры передней HD170/270/450, MBS","2.000","шт","64.00","",""
"","ФР-00002250","26322-84400","26322-84400","MBS","Элемент фильтрующий масляный (бумажный) D6HA,D6CB38/41  HD170/AeroQueen , MBS","7.000","шт","235.00","",""
"","ФР-00006561","59110-7C200","59110-7C200","MBS","Энергоаккумулятор HD250/260, MBS","1.000","шт","14725.00","",""
"","PORTER (дв.D4BF)","","","","","","","","",""
"","00000000652","55300-4B700","2L9","YJT KOREA","Амортизатор задний Porter, YJT KOREA","23.000","шт","998.00","",""
"","ФР-00004031","55300-4B700","CR553004B700","CR","Амортизатор задний Porter CR, CR","43.000","шт","789.00","",""
"","00000000655","54300-4B000","PJA-003","YJT KOREA","Амортизатор передний Porter, YJT KOREA","20.000","шт","884.00","",""
"","ФР-00004035","54300-4B700","CR543004B700","CR","Амортизатор передний Porter CR, CR","64.000","шт","827.00","",""
"","00000000429","86510-4B010","EX-86510-4B010","EX-TRIM KOREA","Бампер (накладка) передний  Porter, EX-TRIM KOREA","1.000","шт","2660.00","",""
"","ФР-00000190","98610-4B000","986104B000","OEM KOREA","Бачок омывателя Porter, OEM KOREA","25.000","шт","361.00","",""
"","00000003090","39160-42063","39160-42063","YJT","Блок управления свечами накаливания Porter, YJT","2.000","шт","638.00","",""
"","00000005298","22321-42001","22321-42001","MBS","Болт головки блока Porter, MBS","64.000","шт","75.00","",""
"","00000003557","49129-43000","49129-43000","MBS","Болт крепления карданного фланца Porter, MBS","10.000","шт","43.00","",""
"","ФР-00011875","23311-11704","ARG171701 ","OEM","Болт крепления маховика Porter, OEM","5.000","шт","51.00","",""
"","ФР-00007492","21114-42000","21114-42000","MBS","Болт крышки коленвала Porter, MBS","2.000","шт","110.00","",""
"","00000003255","54532-4B000","54532-4B000","MBS","Болт переднего рычага (сход-развал) Porter, MBS","12.000","шт","219.00","",""
"","ФР-00001160","54719-43001","54719-43001","TYB","Болт переднего стабилизатора (стойка в сборе) Porter/Porter 2, TYB","300.000","шт","126.00","",""
"","ФР-00000118","65791-4B000","65791-4B000","MBS","Болт подушки крепления кабины Porter , MBS","4.000","шт","61.00","",""
"","ФР-00005910","55141-44100","CR5514144100","CR","Болт рессоры центральный (c гайкой) Porter, CR","562.000","компл.","37.00","",""
"","ФР-00005911","55141-44100","CR5514144100-10","CR","Болт рессоры центральный удлинненый (c гайкой) Porter, CR","450.000","компл.","46.00","",""
"","ФР-00005923","55141-47000","CR5514147000","CR","Болт рессоры центральный удлинненый (с гайкой) Porter 2, CR","529.000","компл.","43.00","",""
"","ФР-00005439","43221-4A000","43221-4A000","MBS","Вал МКПП вторичный Porter, MBS","1.000","шт","2131.00","",""
"","ФР-00000148","43221-47000","43221-47000","MBS KOREA","Вал МКПП вторичный Porter 2, MBS KOREA","4.000","шт","6270.00","",""
"","00000000189","43215-4A010","43215-4A010","MBS KOREA","Вал МКПП промежуточный Porter, MBS KOREA","1.000","шт","4845.00","",""
