"","","","","","","","","","",""
"","00000000694","51830-44000","1411ABLAA0    ","POS KOREA","Сальник ступицы переднего колеса (50х65х9) Porter/Porter 2, POS KOREA","81.000","шт","45.00","",""
"","00000000681","36710-42021","3671042021","JIN YOU KOREA","Свеча накаливания (11V/12V) Porter, JIN YOU KOREA","406.000","шт","243.00","",""
"","ФР-00001331","96620-38102","9662038102","SKY/SUNG IL KOREA","Сигнал звуковой Porter, SKY/SUNG IL KOREA","30.000","шт","466.00","",""
"","00000000936","43360-4A000","43360-4A000","MBS KOREA","Синхронизатор 3/4 передачи Porter, MBS KOREA","2.000","шт","1425.00","",""
"","00000001983","94210-43861","94210-43861","MBS KOREA","Спидометр Porter, MBS KOREA","2.000","шт","3705.00","",""
"","00000000891","36100-42050","S1015","VALEO KOREA","Стартер Porter, VALEO KOREA","47.000","шт","8265.00","",""
"","00000001182","86110-43012","8611043012","KMK GLASS","Стекло ветровое (с защит. полосой) Porter , KMK GLASS","20.000","шт","2090.00","",""
"","ФР-00011920","55225-4E000","CR552254E000","CR","Стремянка крепления задней рессоры (с гайками) Bongo 3, CR","26.000","компл.","285.00","",""
"","ФР-00006892","55225-4E000","55225-4E000","MBS","Стремянка крепления задней рессоры Bongo 3, MBS","2.000","шт","334.00","",""
"","ФР-00004454","55225-44150","CR5522544150","CR","Стремянка крепления задней рессоры Porter (с гайками), CR","84.000","компл.","209.00","",""
"","ФР-00004453","55225-44150","CR5522544150-10","CR","Стремянка крепления задней рессоры удлиненная Porter (с гайками), CR","94.000","компл.","238.00","",""
"","ФР-00002498","58190-4BA20","EX581904BA20","MANDO","Суппорт передний правый Porter, MANDO","1.000","шт","2992.00","",""
"","00000001615","58190-4BA20","58190-4BA20","MBS KOREA","Суппорт передний правый Porter, MBS KOREA","1.000","шт","3705.00","",""
"","ФР-00004821","22223-32004","22223-32004","MBS","Сухарь клапана Porter, MBS","1.000","шт","19.00","",""
"","00000000553","22223-32004","22223-32004","MBS KOREA","Сухарь клапана Porter, MBS KOREA","1.000","шт","19.00","",""
"","00000000504","VKD80002","80002","VALEO KOREA","Сцепление к-т (без выжимного) Porter, VALEO KOREA","54.000","компл.","4180.00","",""
"","ФР-00007350","HDK136               ","HDK136        ","VALEO KOREA","Сцепление к-т (диск+корзина+подшипник) Porter, VALEO KOREA","37.000","компл.","4750.00","",""
"","00000005726","25510-42100","25510-42100","MBS","Термостат Porter, MBS","1.000","шт","665.00","",""
"","ФР-00006388","25510-42100","2551042100","SHAP KOREA","Термостат Porter, SHAP KOREA","98.000","шт","428.00","",""
"","ФР-00005873","98210-4B000","98210-4B000","MBS KOREA","Трапеция стеклоочистителя Porter, MBS KOREA","8.000","шт","1093.00","",""
"","ФР-00006685","32970-43200","32970-43200","INFAC","Трос газа Porter, INFAC","8.000","шт","171.00","",""
"","ФР-00005427","32740-4B100","32740-4B100","MBS","Трос газа ручного Porter, MBS","1.000","шт","390.00","",""
"","ФР-00001322","43770-4B360","437704B360","INFAC KOREA","Трос МКПП (2шт.) Porter, INFAC KOREA","61.000","компл.","1425.00","",""
"","ФР-00000409","94310-4B006","943104B006","INFAC","Трос спидометра (гибкий вал) Porter, INFAC","3.000","шт","696.00","",""
"","ФР-00004719","94310-4B006","94310-4B006","MBS","Трос спидометра (гибкий вал) Porter, MBS","2.000","шт","873.00","",""
"","ФР-00008320","94310-4B011","943104B011","SKY","Трос спидометра (гибкий вал) Porter, SKY","1.000","шт","872.00","",""
"","ФР-00007130","59911-4B164","599114B164","INFAC","Трос тормоза ручного Porter, INFAC","3.000","шт","1615.00","",""
"","ФР-00000223","59911-4B164","599114B164","INFAC KOREA","Трос тормоза ручного Porter, INFAC KOREA","112.000","шт","1140.00","",""
"","00000003796","28610-4B261","7677","FOBOS","Труба приемная глушителя (гофра) Porter, FOBOS","5.000","шт","1710.00","",""
"","00000003488","57570-4B001","57570-4B001","MBS","Трубка ГУРа Porter, MBS","2.000","шт","442.00","",""
"","00000001094","57780-4B000","57780-4B000","MBS KOREA","Трубка ГУРа Porter, MBS KOREA","3.000","шт","380.00","",""
"","ФР-00011370","57520-4B102","575204B102","HS R&A","Трубка ГУРа Porter, HS R&A","4.000","шт","371.00","",""
"","ФР-00005083","37482-42540","3748242540","GEUN YOUNG KOREA","Трубка масляная вакуумного насоса Porter, GEUN YOUNG KOREA","51.000","шт","238.00","",""
"","ФР-00000727","37482-42540","KHSH-061","KOREASTAR KOREA","Трубка масляная вакуумного насоса Porter, KOREASTAR KOREA","1.000","шт","238.00","",""
"","ФР-00004266","28246-42850","28246-42850","MBS","Трубка масляная турбокомпрессора возвратная Porter, MBS","1.000","шт","236.00","",""
"","ФР-00002876","26440-4B102","26440-4B102","MBS","Трубка масляного радиатора Porter, MBS","1.000","шт","1985.00","",""
"","ФР-00011874","37482-42100","PXNMA030","PARTS MALL","Трубка системы охлаждения Porter, PARTS MALL","1.000","шт","191.00","",""
"","00000003541","25442-4B150","25442-4B150","MBS","Трубка системы охлаждения Porter, MBS","2.000","шт","563.00","",""
"","00000003175","41820-4B001","41820-4B001","MBS","Трубка сцепления Porter, MBS","1.000","шт","114.00","",""
"","ФР-00007115","31411-42001","31411-42001","MBS","Трубка топливная высокого давления 1-го цилиндра Porter, MBS","1.000","шт","644.00","",""
"","00000004574","31412-42001","31412-42001","MBS","Трубка топливная высокого давления 2-го цилиндра Porter, MBS","1.000","шт","651.00","",""
"","ФР-00001802","58722-4B000","58722-4B000","MBS","Трубка тормозная Porter, MBS","2.000","шт","196.00","",""
"","00000000114","28200-4B160","700273-5002","GARRET KOREA","Турбокомпрессор D4BF Porter, GARRET KOREA","13.000","шт","20900.00","",""
"","00000004174","28200-4B160","700273-5002S","GARRET","Турбокомпрессор D4BF Porter, GARRET","4.000","шт","20900.00","",""
"","00000006207","57730-43000","RKH-04","SAMYUNG KOREA","Тяга рейки рулевой Porter, SAMYUNG KOREA","11.000","шт","333.00","",""
"","ФР-00000723","57730-43000","YKH-01","YULIMTECH KOREA","Тяга рейки рулевой Porter, YULIMTECH KOREA","34.000","шт","333.00","",""
"","00000000369","57730-4B000","CRKH-4","CTR KOREA","Тяга рейки рулевой Porter, CTR KOREA","27.000","шт","504.00","",""
"","00000004034","54750-4B002","54750-4B002","MBS","Тяга стабилизатора переднего (реактивная тяга) Porter , MBS","6.000","шт","835.00","",""
"","00000004299","92301-4B001","","OEM","Указатель поворота левый Porter, OEM","1.000","шт","561.00","",""
"","ФР-00005220","92301-4B001","CR923014B001","CR","Указатель поворота левый Porter CR, CR","32.000","шт","380.00","",""
"","ФР-00005221","92302-4B001","CR923024B001","CR","Указатель поворота правый Porter CR, CR","25.000","шт","380.00","",""
"","00000003430","82150-4B000AQ","82150-4B000AQ","MBS","Уплотнитель двери левой Porter, MBS","2.000","шт","1140.00","",""
"","ФР-00008982","54313-4B000","54313-4B000","MBS","Упорное кольцо втулки амортизатора подвески Porter, MBS","10.000","шт","15.00","",""
"","00000004293","86520-4B000","865204B000","NBN KOREA","Усилитель бампера переднего Porter, NBN KOREA","17.000","шт","2660.00","",""
"","ФР-00006996","58610-4B100","586104B100","MANDO KOREA","Усилитель тормоза вакуумный Porter, MANDO KOREA","8.000","шт","4750.00","",""
"","00000001684","58610-4B100","58610-4B100","MBS KOREA","Усилитель тормоза вакуумный Porter, MBS KOREA","1.000","шт","5035.00","",""
"","ФР-00005215","92101-43810","CR9210143810","CR","Фара передняя левая (-97) H100 CR, CR","39.000","шт","722.00","",""
"","00000004296","92101-4B000","921014B000","NBN KOREA","Фара передняя левая Porter, NBN KOREA","1.000","шт","855.00","",""
"","ФР-00007051","92102-4B000","23151120","ATEK","Фара передняя правая (без ламп) Porter, ATEK","10.000","шт","713.00","",""
"","ФР-00005214","92102-4B000","CR921024B000","CR","Фара передняя правая (без лампы) Porter CR, CR","52.000","шт","523.00","",""
"","00000004297","92102-4B000","921024B000","NBN KOREA","Фара передняя правая Porter, NBN KOREA","36.000","шт","855.00","",""
"","ФР-00006604","28130-44000","CR2813044000","CR","Фильтр воздушный (с крыльчаткой) Porter, CR","165.000","шт","276.00","",""
"","00000000009","28130-44000","JA-H13","JHF KOREA","Фильтр воздушный Porter, JHF KOREA","304.000","шт","314.00","",""
"","ФР-00011334","26310-4A000","PBA-023","PARTS MALL","Фильтр масляный Porter/Porter 2/Starex/Bongo 3, PARTS MALL","289.000","шт","190.00","",""
"","ФР-00000753","31945-44000","PCA003","PARTS MALL","Фильтр топливный Porter, PARTS MALL","144.000","шт","243.00","",""
"","00000000015","31945-44000","JFC-H03","JHF KOREA","Фильтр топливный Porter/ ISUZU NQR-75/K2500, JHF KOREA","11.000","шт","276.00","",""
"","ФР-00005223","92401-4B100","CR924014B100","CR","Фонарь задний левый/правый (без ламп) Porter CR, CR","106.000","шт","475.00","",""
"","00000004301","92401-4B100","924014B100","OEM KOREA","Фонарь задний левый/правый Porter, OEM KOREA","227.000","шт","618.00","",""
"","00000002862","98614-43300","98614-43300","MBS","Форсунка стеклоомывателя Porter, MBS","2.000","шт","266.00","",""
"","00000000154","33800-42500","KF-25/LF22/27","DELPHI KOREA","Форсунка топливная Porter, DELPHI KOREA","46.000","шт","1805.00","",""
"","00000000173","41600-4B001","KAC0957","TCIC KOREA","Цилиндр сцепления главный Porter, TCIC KOREA","27.000","шт","808.00","",""
"","00000000178","41700-43150","KAO0501","TCIC KOREA","Цилиндр сцепления рабочий Porter, TCIC KOREA","17.000","шт","665.00","",""
"","00000003275","41700-43150","41700-43150","MBS","Цилиндр сцепления рабочий Porter, MBS","10.000","шт","1070.00","",""
"","ФР-00006643","59110-4B010","11B0070","TCIC","Цилиндр тормозной главный Porter, TCIC","2.000","шт","2375.00","",""
"","ФР-00006992","58320-4B820","11R0552CG","TCIC KOREA","Цилиндр тормозной задний левый Porter, TCIC KOREA","40.000","шт","713.00","",""
"","00000001965","58320-4B820","58320-4B820","MBS KOREA","Цилиндр тормозной задний левый Porter, MBS KOREA","13.000","шт","1140.00","",""
"","00000006081","58420-4B820","58420-4B820","MBS","Цилиндр тормозной задний правый Porter, MBS","2.000","шт","950.00","",""
"","ФР-00006099","58420-4B820","11T0551","TCIC KOREA","Цилиндр тормозной задний правый Porter, TCIC KOREA","31.000","шт","665.00","",""
"","ФР-00004542","22322-42002","22322-42002","MBS","Шайба болта головки блока Porter, MBS","10.000","шт","24.00","",""
"","00000003688","13510-08003","13510-08003","MBS","Шайба болта крепления генератора Porter, MBS","8.000","шт","10.00","",""
"","ФР-00003941","58398-44100","58398-44100","MBS","Шайба ограничителя бокового смещения колодок Porter, MBS","10.000","шт","98.00","",""
"","ФР-00001043","58397-44100","58397-44100","MBS","Шайба ограничителя бокового смещения колодок Porter , MBS","10.000","шт","25.00","",""
"","ФР-00003948","58365-4B800","58365-4B800","MBS","Шайба пальца регулировочного задних тормоз Porter, MBS","6.000","шт","24.00","",""
"","00000004116","54544-4A000","54544-4A000","MBS","Шайба регулировки сход-развала Porter, MBS","5.000","шт","53.00","",""
"","00000001301","54718-44000","54718-44000","MBS KOREA","Шайба стойки переднего стабилизатора Porter, MBS KOREA","1.000","шт","4.00","",""
"","00000002356","54717-44001","54717-44001","MBS","Шайба стойки переднего стабилизатора Porter, MBS","2.000","шт","29.00","",""
"","00000003819","58358-4A000","58358-4A000","MBS","Шайба тормозного механизма прижимной пружины Porter, MBS","10.000","шт","24.00","",""
"","ФР-00005367","24423-42200","24423-42200","MBS","Шестерня вала коленчатого Porter, MBS","1.000","шт","756.00","",""
"","00000001304","43250-4A111","43250-4A111","MBS KOREA","Шестерня МКПП вала вторичного 1 й передачи Porter, MBS KOREA","3.000","шт","1121.00","",""
"","ФР-00005429","43270-4A100","43270-4A100","MBS","Шестерня МКПП вала вторичного 2-ой передачи Porter, MBS","1.000","шт","1615.00","",""
"","00000000199","43240-4A112","43240-4A112","MBS KOREA","Шестерня МКПП вала вторичного 5-ой передачи Porter, MBS KOREA","1.000","шт","3135.00","",""
"","00000001305","43230-4D000","43230-4D000","MBS KOREA","Шестерня МКПП вала промежуточного 5-ой передачи Porter, MBS KOREA","1.000","шт","4750.00","",""
"","ФР-00005446","43236-4D001","43236-4D001","MBS","Шестерня МКПП вала промежуточного задней передачи Porter, MBS","1.000","шт","950.00","",""
"","00000001941","43236-4D001","43236-4D001","MBS KOREA","Шестерня МКПП вала промежуточного задней передачи Porter, MBS KOREA","1.000","шт","897.00","",""
"","00000003261","43311-4D500","43311-4D500","MBS KOREA","Шестерня МКПП промежуточная заднего хода Porter, MBS KOREA","3.000","шт","903.00","",""
"","00000001944","43311-4D001","43311-4D001","MBS KOREA","Шестерня МКПП промежуточная заднего хода Porter, MBS KOREA","2.000","шт","795.00","",""
"","ФР-00002079","43311-4D500","43311-4D500","MBS","Шестерня МКПП промежуточная заднего хода Porter, MBS","2.000","шт","1055.00","",""
"","00000002491","23352-42510","23352-42510","MBS","Шестерня ремня ГРМ Porter, MBS","1.000","шт","945.00","",""
"","00000006082","23124-42001","23124-42001","MBS","Шкив коленчатого вала Porter, MBS","2.000","шт","2219.00","",""
"","ФР-00008325","26713-42100","26713-42100","MBS","Шланг вентиляции картера двигателя Porter, MBS","1.000","шт","53.00","",""
"","00000004227","31331-4B000","31331-4B000","MBS","Шланг заливной горловины Porter, MBS","4.000","шт","119.00","",""
"","00000001934","31331-4B000","31331-4B000","MBS KOREA","Шланг заливной горловины Porter, MBS KOREA","2.000","шт","119.00","",""
"","ФР-00001375","57510-4B010","57510-4B010","MBS","Шланг от бачка к насосу ГУРа Porter, MBS","1.000","шт","273.00","",""
"","00000006606","26450-4B102","26450-4B102","MBS","Шланг системы охлаждения маслянного радиатора (обратка) Porter, MBS","1.000","шт","2071.00","",""
"","00000000685","41850-4B001","41850-4B001","MBS KOREA","Шланг сцепления Porter, MBS KOREA","4.000","шт","143.00","",""
"","ФР-00002307","58813-4B001","58813-4B001","MBS","Шланг тормозной передний верхний (между трубками) Porter, MBS","1.000","шт","646.00","",""
"","ФР-00000432","52755-4F000","52755-4F000","MBS","Шпилька ступицы заднего колеса Porter 2, MBS","15.000","шт","95.00","",""
"","ФР-00004698","52755-44102","5275544102","TYB KOREA","Шпилька ступицы заднего колеса Porter/Porter 2, TYB KOREA","1035.000","шт","29.00","",""
"","ФР-00000228","52755-4A500","527554A500","TYB KOREA","Шпилька ступицы заднего колеса Porter/Starex/H-1, TYB KOREA","1195.000","шт","29.00","",""
"","ФР-00004699","52755-47000","5275547000","TYB KOREA","Шпилька ступицы переднего колеса Porter, TYB KOREA","1069.000","шт","29.00","",""
"","00000004010","23141-42000","23141-42000","MBS","Шпонка коленчатого вала Porter, MBS","8.000","шт","53.00","",""
"","ФР-00006692","23141-42010","23141-42010","MBS","Шпонка коленчатого вала Porter, MBS","8.000","шт","44.00","",""
"","ФР-00002358","43372-4A011","43372-4A011","MBS KOREA","Шпонка МКПП синхронизатора Porter, MBS KOREA","3.000","шт","24.00","",""
"","00000005727","43842-39000","43842-39000","MBS","Штифт вилки КПП Porter, MBS","10.000","шт","19.00","",""
"","ФР-00006845","26611-42010","26611-42010","MBS","Щуп уровня масла Porter, MBS","3.000","шт","43.00","",""
"","COUNTY,HD65/72/78 (дв. D4..)","","","","","","","","",""
"","00000002710","115D31R","115D31R","SOLITE","Аккумулятор 95a/h 750A (с бортом) HD65/72/78/Porter/Porter 2, SOLITE","3.000","шт","6278.00","",""
"","00000000650","55300-5A120","PJA-108","YJT KOREA","Амортизатор задний County, YJT KOREA","80.000","шт","1093.00","",""
"","ФР-00004032","55300-5A120","CR553005A120","CR","Амортизатор задний County CR, CR","252.000","шт","751.00","",""
"","00000000651","55300-5H500","PJA-109","YJT KOREA","Амортизатор задний HD72, YJT KOREA","53.000","шт","1093.00","",""
"","ФР-00004033","55300-5H500","CR553005H500","CR","Амортизатор задний HD72 CR, CR","31.000","шт","760.00","",""
"","ФР-00004034","55300-5K001","CR553005K001","CR","Амортизатор задний HD78 CR, CR","109.000","шт","827.00","",""
"","00000005733","54300-5A200","543105А300","YJT KOREA","Амортизатор передний County, YJT KOREA","53.000","шт","903.00","",""
"","00000000653","54300-5A300","54310-5А300","YJT KOREA","Амортизатор передний County, YJT KOREA","58.000","шт","903.00","",""
"","ФР-00004036","54300-5A300","CR543005A300","CR","Амортизатор передний County CR, CR","138.000","шт","751.00","",""
"","00000004092","54300-5H500","543005H500","CHUNWOO","Амортизатор передний HD72, CHUNWOO","14.000","шт","1059.00","",""
"","00000003215","54300-5K001","543005K001","CHUNWOO","Амортизатор передний HD78, CHUNWOO","13.000","шт","1086.00","",""
"","ФР-00005842","31100-5L000","31100-5L000","MBS KOREA","Бак топливный D4GA HD65/78 , MBS KOREA","1.000","шт","14155.00","",""
"","00000005943","51110-5H601","51110-5H601","MBS","Балка оси передняя ф30 HD72, MBS","1.000","шт","34200.00","",""
"","00000002334","59210-5H000","59210-5H000","MBS","Баллон воздушный ресивер HD65/72/78, MBS","1.000","шт","1972.00","",""
"","00000001571","86510-58000","86510-58000","MBS KOREA","Бампер (накладка) передний County Кузбасс, MBS KOREA","2.000","шт","11875.00","",""
"","00000002804","86510-56000","86510-56000","MBS","Бампер передний н\о HD72/78, MBS","1.000","шт","2469.00","",""
"","00000006586","86510-5K000","86510-5K000","MBS","Бампер передний с круглыми противотуман.евро3 HD78, MBS","2.000","шт","6548.00","",""
"","00000000980","59841-45201","59841-45201","MBS KOREA","Барабан стояночного тормоза HD72, MBS KOREA","1.000","шт","950.00","",""
"","00000001568","52761-5A101","R8052","VALEO KOREA","Барабан тормозной 5шп.85мм HD65/County, VALEO KOREA","74.000","шт","3705.00","",""
"","00000002020","52761-5H200","R8051","VALEO KOREA","Барабан тормозной 6шп. 85мм. HD72, VALEO KOREA","57.000","шт","3515.00","",""
"","00000003503","52761-5K501","R1532","VALEO KOREA","Барабан тормозной 6шп.110мм.HD78/Богдан, VALEO KOREA","94.000","шт","3895.00","",""
"","ФР-00004017","52761-5K501","CR527615K501-1Q","CR","Барабан тормозной 6шп.110мм.HD78/Богдан CR, CR","181.000","шт","3278.00","",""
"","ФР-00001847","57800-5L200","57800-5L200","MBS KOREA","Бачок ГУР HD65/78/Богдан, MBS KOREA","1.000","шт","2375.00","",""
"","ФР-00001815","98310-5H201","983105H201","OEM KOREA","Бачок омывателя HD65/72/78, OEM KOREA","14.000","шт","475.00","",""
"","ФР-00001831","25360-5L200","25360-5L200","MBS KOREA","Бачок расширительный D4GA HD65/78/Богдан, MBS KOREA","14.000","шт","3135.00","",""
"","ФР-00005794","25361-5H000","253615H000","OEM KOREA","Бачок расширительный HD72/78, OEM KOREA","10.000","шт","428.00","",""
"","00000002092","96810-8C100","96810-8C100","MBS KOREA","Блок предохранителей звукового сигнала HD72/78/120, MBS KOREA","5.000","шт","333.00","",""
"","00000000470","ESD600E5-8600","ESD600E1-5000B","DASCO KOREA","Блок управления двери County ЕВРО-2, DASCO KOREA","14.000","шт","6460.00","",""
"","ФР-00002421","97311-8A000","CR973118A000","CR","Блок управления котла County, CR","53.000","шт","3325.00","",""
"","ФР-00005265","54393-45001","54393-45001","MBS","Болт амортизатора переднего нижний HD65/72/78 , MBS","5.000","шт","73.00","",""
"","00000002481","22321-83000","22321-83000","MBS KOREA","Болт головки блока длинный D4AL HD72, MBS KOREA","2.000","шт","143.00","",""
"","ФР-00002111","22331-45000","22331-45000","MBS","Болт головки блока длинный D4DB/DD County/HD78, MBS","10.000","шт","143.00","",""
"","00000000507","22321-41001","2232141001","OEM KOREA","Болт головки блока короткий D4AL HD72, OEM KOREA","9.000","шт","81.00","",""
"","00000003523","22321-45000","22321-45000","MBS","Болт головки блока короткий D4DB/DD County/HD78, MBS","21.000","шт","162.00","",""
"","ФР-00004732","52686-45400","52686-45400","MBS","Болт крепления дисковых тормозов HD65/72/78/County, MBS","20.000","шт","59.00","",""
"","00000003999","52763-45000","52763-45000","MBS","Болт крепления задней ступицы HD65/72/78/County, MBS","10.000","шт","57.00","",""
"","ФР-00004362","21114-41001","21114-41001","MBS","Болт крепления коленвала D4AL HD72, MBS","6.000","шт","42.00","",""
"","ФР-00005302","55552-5H000","555525H000","TYB KOREA","Болт крепления передней рессоры HD65/72/78 , TYB KOREA","137.000","шт","76.00","",""
"","00000002245","49129-45200","49129-45200","MBS","Болт крепления фланца карданного HD65/72/78/County, MBS","25.000","шт","33.00","",""
"","ФР-00000360","23513-41000","23513-41000","MBS","Болт крепления шатуна D4AL HD72, MBS","10.000","шт","17.00","",""
"","ФР-00005913","55141-5A200","CR551415A200","CR","Болт рессоры задней центральный (c гайкой) County, CR","324.000","компл.","43.00","",""
"","ФР-00005919","55141-5K500","CR551415K500","CR","Болт рессоры задней центральный (с гайкой) HD72/78 CR, CR","459.000","компл.","57.00","",""
"","ФР-00005912","54141-5A200","CR541415A200","CR","Болт рессоры передней центральный (c гайкой) County, CR","773.000","компл.","38.00","",""
"","ФР-00005917","54141-5K500","CR541415K500","CR","Болт рессоры передней центральный (с гайкой) HD65/72/78 CR, CR","484.000","компл.","48.00","",""
"","ФР-00005918","54141-5K500","CR541415K500-10","CR","Болт рессоры передней центральный удлинненый (с гайкой) HD65/72/78 CR, CR","684.000","компл.","57.00","",""
"","ФР-00006652","86811-5H102","86811-5H102","MBS","Брызговик передний левый (задняя часть) HD72, MBS","3.000","шт","1087.00","",""
"","00000002397","86821-5H103","86821-5H103","MBS","Брызговик передний правый (задняя часть) HD72, MBS","1.000","шт","821.00","",""
"","ФР-00001317","36139-41000","3613941000","OEM KOREA","Вал бендикса стартера AL/DB//DD/DA/DC HD72, OEM KOREA","29.000","шт","760.00","",""
"","00000001847","49100-5H510","49100-5H510","MBS KOREA","Вал карданный (задняя часть) (82 см) HD78, MBS KOREA","1.000","шт","19000.00","",""
