"","","","","","","","","","",""
"","","","ПРАЙС-ЛИСТ","","","","","","",""
"","","","","","21.08.2017","","","","",""
"","","","ООО ""Торговый дом Токус""","","","","","","",""
"","","","ИНН/КПП  9715202280/771501001","","","","","","",""
"","","","Юр. адрес:  127253  г. Москва, Лианозовский проезд, 6","","","","","","",""
"","","","Факт. адрес: 127253  г. Москва, Лианозовский проезд, 6","","","","","","",""
"","","","Контактные телефоны:","","","","","","",""
"","","","","","","","НОВЫЙ ТОВАР","","",""
"","","","","","","","","","",""
"","","","","","","","АКЦИЯ","","",""
"","","","","","","","","","",""
"","","","","","","","","","",""
"","","","                              E-mail:       sales@tokus77.ru","","","","","","",""
"","","","Интернет-магазин: tokus77.ru","","","","","","",""
"","Код","Артикул","Артикул2","Производитель","Номенклатура","Остаток","Спец цена","","",""
"","","","","","","","Ед.","Цена, RUB","",""
"","<...>","","","","","","","","",""
"","Товары","","","","","","","","",""
"","Прочее","","","","","","","","",""
"","ФР-00011691","22135-26011","22135-26011","MBS","Втулка ГБЦ, MBS","3.000","шт","91.00","",""
"","ФР-00006409","94583552","94583552","CR","Втулка рычага переднего Daewoo Damas, CR","48.000","шт","30.00","",""
"","ФР-00011523","52951-11210","52951-11210","MBS","Гайка колеса Sonata, MBS","20.000","шт","29.00","",""
"","ФР-00008778","54559-26000","54559-26000","MBS","Гайка стойки стабилизатора переднего HD35/Solaris/Rio/Santa Fe, MBS","21.000","шт","24.00","",""
"","ФР-00011570","95150-3B000","95150-3B000","MBS KOREA","Датчик сенсорный Equus/Centennial, MBS KOREA","1.000","шт","665.00","",""
"","ФР-00006519","NEZAM","NEZAM","FROZ","Жидкость незамерзающая 5л. (-30), FROZ","35.000","шт","76.00","",""
"","ФР-00004991","LR055455","1632KT","KOTL","Колодки тормозные дисковые задние Land Rover Discovery/Range/Nissan Almera, KOTL","1.000","компл.","561.00","",""
"","ФР-00004993","A1644202720","1643KT","KOTL","Колодки тормозные дисковые задние Mersedes-Benz W164 ML 05/W251/R-CLASS, KOTL","1.000","компл.","551.00","",""
"","ФР-00005048","04466-60140","3464KT","KOTL","Колодки тормозные дисковые задние Toyota LC 80/90/120/Mitsubishi Pagero, KOTL","1.000","компл.","371.00","",""
"","ФР-00004967","77362219","1517KT","KOTL","Колодки тормозные дисковые передние Citroen Jumper/Fiat Ducato/Peugeot Boxer, KOTL","3.000","компл.","570.00","",""
"","ФР-00005003","1566232","1683KT","KOTL","Колодки тормозные дисковые передние Ford Galaxy/Mondeo/S-Max/Land Rover Freelander2/Volvo S60/V60, KOTL","1.000","компл.","650.00","",""
"","ФР-00011418","58101-4HA10","CR581014HA10","CR","Колодки тормозные передние (4шт.) Starex/H-1, CR","48.000","шт","665.00","",""
"","00000003978","21513-23001","21513-23001","MBS","Кольцо уплотнительное сливной пробки поддона ALL, MBS","20.000","шт","15.00","",""
"","ФР-00011985","57558-33000","57558-33000","MBS","Кольцо уплотнительное трубки ГУР Porter, MBS","10.000","шт","32.00","",""
"","ФР-00011818","56820-3E900","56820-3E900","CARDEX","Наконечник рулевой правый Sorento, CARDEX","1.000","шт","475.00","",""
"","ФР-00002514","58161-M2000","58161-M2000","MBS","Палец суппорта верхний Porter, MBS","4.000","шт","81.00","",""
"","ФР-00011926","13х1000","13A1000C","OEM","Ремень, OEM","4.000","шт","200.00","",""
"","ФР-00005666","ME900744","B-44","DONGIL KOREA","Ремень клиновой многослойный , DONGIL KOREA","5.000","шт","361.00","",""
"","ФР-00002788","13A1500C","AVX13X1500","DAYCO","Ремень клиновый Korando, DAYCO","2.000","шт","244.00","",""
"","ФР-00011924","6PK1415","6PK1415","OEM","Ремень поликлиновой, OEM","2.000","шт","436.00","",""
"","ФР-00007790","06-01755-SX","6PK1755","STELLOX","Ремень приводной поликлиновой, STELLOX","3.000","шт","450.00","",""
"","ФР-00005133","94950-4H000YR","94950-4H000YR","MBS","Реостат подсветки приборной панели Starex, MBS","1.000","шт","1425.00","",""
"","00000005228","28113-4H000","28113-4H000","MBS","Фильтр воздушный Starex/H-1, MBS","1.000","шт","469.00","",""
"","00000005229","97617-4H000","97617-4H000","MBS","Фильтр салонный Starex/H-1, MBS","2.000","шт","1006.00","",""
"","ФР-00011258","23131-4A000","23131-4A000","MBS","Шпонка коленвала Starex, MBS","8.000","шт","15.00","",""
"","00000005508","14303-06140","14303-06140","MBS","Шпонка распредвала Accent/Porter, MBS","20.000","шт","15.00","",""
"","PORTER 2 (дв.D4CB)/BONGO 3","","","","","","","","",""
"","ФР-00002412","55300-4E700","553004E700","YJT KOREA","Амортизатор задний Bongo 3, YJT KOREA","2.000","шт","1425.00","",""
"","ФР-00006096","55300-4F350","553004F350","YJT KOREA","Амортизатор задний Porter 2, YJT KOREA","4.000","шт","1093.00","",""
"","00000001779","55300-4F050","553004F050","YJT","Амортизатор задний Porter 2, YJT","1.000","шт","808.00","",""
"","ФР-00006990","55300-4F050","553004F050","YJT KOREA","Амортизатор задний Porter 2, YJT KOREA","38.000","шт","808.00","",""
"","ФР-00008003","55300-4F050","CR553004F050","CR","Амортизатор задний Porter 2, CR","188.000","шт","808.00","",""
"","ФР-00008002","54300-4F050","CR543004F050","CR","Амортизатор передний Porter 2, CR","178.000","шт","808.00","",""
"","ФР-00004912","54300-4F050","543004F050","YJT KOREA","Амортизатор передний Porter 2, YJT KOREA","46.000","шт","950.00","",""
"","00000002226","96200-4F100","96200-4F100","MBS KOREA","Антенна Porter 2, MBS KOREA","2.000","шт","219.00","",""
"","00000006303","86511-4F500","86511-4F500","MBS","Бампер (накладка) передний  Porter 2, MBS","1.000","шт","7980.00","",""
"","ФР-00008222","86511-4F010","CR865114F010","CR","Бампер (накладка) передний (круглые птф)  Porter 2, CR","12.000","шт","2660.00","",""
"","ФР-00008218","86511-4E541","CR865114E541","CR","Бампер передний (12-) Bongo 3, CR","5.000","шт","3135.00","",""
"","ФР-00000417","58411-4F000","58411-4F000","MBS","Барабан тормозной Porter 2, MBS","1.000","шт","2701.00","",""
"","00000002235","98611-4F000","98611-4F000","MBS KOREA","Бачок омывателя Porter 2, MBS KOREA","1.000","шт","314.00","",""
"","ФР-00004590","58163-33000","58163-33000","MBS","Болт  суппорта тормозного переднего Porter 2 , MBS","24.000","шт","55.00","",""
"","ФР-00004647","11313-06553","11313-06553","MBS","Болт Porter M8, MBS","1.000","шт","9.00","",""
"","00000005788","22321-4A000","22321-4A000","MBS","Болт головки блока D4CB Porter 2, MBS","26.000","шт","143.00","",""
"","ФР-00005921","55141-4E000","CR551414E000","CR","Болт рессоры центральный (с гайкой) Bongo 3, CR","217.000","компл.","29.00","",""
"","ФР-00005920","55141-4F000","CR551414F000","CR","Болт рессоры центральный (с гайкой) Porter 2, CR","569.000","компл.","43.00","",""
"","ФР-00005922","55141-4E000","CR551414E000-10","CR","Болт рессоры центральный удлинненый (с гайкой) Bongo 3, CR","197.000","компл.","38.00","",""
"","ФР-00007585","54532-4E000","54532-4E000","MBS","Болт рычага переднего (сход-развала)  Bongo 3 , MBS","3.000","шт","176.00","",""
"","ФР-00003927","58163-4D000","58163-4D000","MBS","Болт суппорта тормозного переднего Porter 2, MBS","20.000","шт","33.00","",""
"","ФР-00006041","61220-4E000","61220-4E000","MBS","Брызговик задний правый Bongo 3, MBS","1.000","шт","627.00","",""
"","00000002216","86831-4F000","86831-4F000","MBS KOREA","Брызговик переднего колеса левый (задняя часть) Porter 2, MBS KOREA","6.000","шт","70.00","",""
"","00000002217","86832-4F000","86832-4F000","MBS KOREA","Брызговик переднего колеса правый (задняя часть) Porter 2, MBS KOREA","3.000","шт","72.00","",""
"","00000002215","86812-4F010","86812-4F010","MBS KOREA","Брызговик переднего колеса правый (передняя часть) Porter 2, MBS KOREA","1.000","шт","124.00","",""
"","ФР-00005279","49100-4F750","49100-4F750","MBS KOREA","Вал карданный Porter 2, MBS KOREA","1.000","шт","9500.00","",""
"","00000002176","43221-4D500","43221-4D500","MBS KOREA","Вал МКПП вторичный D4CB Porter 2/Bongo 3, MBS KOREA","2.000","шт","3325.00","",""
"","00000005339","43215-4D500","43215-4D500","MBS KOREA","Вал МКПП промежуточный  Porter 2/K2500/K2700, MBS KOREA","1.000","шт","8550.00","",""
"","ФР-00011249","43215-47001","43215-47001","MBS KOREA","Вал МКПП промежуточный Porter 2, MBS KOREA","1.000","шт","7980.00","",""
"","ФР-00002719","24100-4A200","24100-4A200","MBS","Вал распределительный левый D4CB Porter 2, MBS","1.000","шт","6555.00","",""
"","ФР-00001889","24100-4A200","24100-4A200","MBS KOREA","Вал распределительный левый D4CB Porter 2, MBS KOREA","2.000","шт","4750.00","",""
"","ФР-00006931","21020-4A930","21020-4A930","DONG SUNG KOREA","Вкладыши коренные std D4CB (группа A) (8шт.) Porter 2, DONG SUNG KOREA","10.000","компл.","803.00","",""
"","00000002145","21020-4A930","21020-4A930","MBS KOREA","Вкладыши коренные std D4CB (группа A) Porter 2, MBS KOREA","5.000","компл.","314.00","",""
"","00000003065","21020-4A930","21020-4A930","MBS","Вкладыши коренные std D4CB (группа A) Porter 2, MBS","4.000","компл.","298.00","",""
"","ФР-00006932","21020-4A931","21020-4A931","KFM KOREA","Вкладыши коренные std D4CB (группа B) (8шт.) Porter 2, KFM KOREA","10.000","компл.","803.00","",""
"","ФР-00008993","21020-4A931","21020-4A931","DONG SUNG KOREA","Вкладыши коренные std D4CB (группа B) (8шт.) Porter 2, DONG SUNG KOREA","10.000","компл.","803.00","",""
"","ФР-00006933","21020-4A932","21020-4A932","KFM KOREA","Вкладыши коренные std D4CB (группа C) (8шт.) Porter 2, KFM KOREA","9.000","компл.","803.00","",""
"","ФР-00008994","21020-4A932","21020-4A932","DONG SUNG KOREA","Вкладыши коренные std D4CB (группа C) (8шт.) Porter 2, DONG SUNG KOREA","8.000","компл.","803.00","",""
"","00000006142","21020-4A932","21020-4A932","MBS","Вкладыши коренные std D4CB (группа C) Porter 2, MBS","3.000","компл.","333.00","",""
"","00000002147","21020-4A932","21020-4A932","MBS KOREA","Вкладыши коренные std D4CB (группа C) Porter 2, MBS KOREA","5.000","компл.","333.00","",""
"","ФР-00006934","21020-4A933","21020-4A933","KFM KOREA","Вкладыши коренные std D4CB (группа D) (8шт.) Porter 2, KFM KOREA","15.000","компл.","803.00","",""
"","ФР-00008995","21020-4A933","21020-4A933","DONG SUNG KOREA","Вкладыши коренные std D4CB (группа D) (8шт.) Porter 2, DONG SUNG KOREA","10.000","компл.","803.00","",""
"","00000002148","21020-4A933","21020-4A933","MBS KOREA","Вкладыши коренные std D4CB (группа D) Porter 2, MBS KOREA","5.000","компл.","333.00","",""
"","00000003994","21020-4A933","21020-4A933","MBS","Вкладыши коренные std D4CB (группа D) Porter 2, MBS","1.000","компл.","333.00","",""
"","ФР-00006935","21020-4A934","210204A934","DONG SUNG KOREA","Вкладыши коренные std D4CB (группа E) (8шт.) Porter 2, DONG SUNG KOREA","29.000","компл.","803.00","",""
"","00000003477","21020-4A934","21020-4A934","MBS","Вкладыши коренные std D4CB (группа E) Porter 2, MBS","12.000","компл.","333.00","",""
"","00000002149","21020-4A934","21020-4A934","MBS KOREA","Вкладыши коренные std D4CB (группа E) Porter 2, MBS KOREA","5.000","компл.","325.00","",""
"","ФР-00006955","23060-4A930","23060-4A930","DONG SUNG KOREA","Вкладыши шатунные STD-A D4CB (RED) (8шт.) Porter 2, DONG SUNG KOREA","2.000","компл.","713.00","",""
"","ФР-00008996","23060-4A931","230604A931","DONG SUNG KOREA","Вкладыши шатунные STD-B D4CB (BLUE) (8шт.) Porter 2, DONG SUNG KOREA","7.000","компл.","760.00","",""
"","ФР-00008997","23060-4A932","230604A932","DONG SUNG KOREA","Вкладыши шатунные STD-C D4CB (NO COLOR) (8шт.) Porter 2, DONG SUNG KOREA","1.000","компл.","713.00","",""
"","ФР-00008998","23060-4A933","230604A933","DONG SUNG KOREA","Вкладыши шатунные STD-D D4CB (YELLOW) (8шт.) Porter 2, DONG SUNG KOREA","10.000","компл.","713.00","",""
"","ФР-00009128","23060-4A943","23060-4A943","MBS","Вкладыши шатунные STD-D D4CB (YELLOW) Porter 2, MBS","1.000","компл.","826.00","",""
"","ФР-00006959","23060-4A934","230604A934","KFM KOREA","Вкладыши шатунные STD-E D4CB (GREEN) (8шт.) Porter 2, KFM KOREA","1.000","компл.","760.00","",""
"","ФР-00008999","23060-4A934","230604A934","DONG SUNG KOREA","Вкладыши шатунные STD-E D4CB (GREEN) (8шт.) Porter 2, DONG SUNG KOREA","10.000","компл.","760.00","",""
"","ФР-00008858","23060-4A944","23060-4A944","MBS KOREA","Вкладыши шатунные STD-E D4CB (GREEN) Porter 2, MBS KOREA","3.000","компл.","428.00","",""
"","ФР-00003370","00183-34775","00183-34775","MBS","Втулка амортизатора переднего/заднего верхняя Bongo 3, MBS","10.000","шт","56.00","",""
"","ФР-00002459","22115-4A000","22115-4A000","MBS","Втулка направляющая выпускного клапана Porter 2, MBS","3.000","шт","76.00","",""
"","ФР-00011879","0K60A-28330","KM39-02879","KROSS","Втулка рессоры (резиновая) K2500/K2700/K3000/K3600/Bongo 3, KROSS","20.000","шт","42.00","",""
"","00000002361","55256-44000","5525644000","SHINHWA KOREA","Втулка рессоры Porter 2/Starex, SHINHWA KOREA","583.000","шт","18.00","",""
"","ФР-00006591","55257-44100","102-017","GEUN YOUNG","Втулка серьги рессоры задней верхняя Porter/Porter 2 , GEUN YOUNG","47.000","шт","23.00","",""
"","ФР-00006988","55257-44100","102-017","GEUN YOUNG KOREA","Втулка серьги рессоры задней верхняя Porter/Porter 2 , GEUN YOUNG KOREA","672.000","шт","19.00","",""
"","ФР-00000720","54813-4F000","548134F000","SHINHWA KOREA","Втулка стабилизатора Porter 2, SHINHWA KOREA","42.000","шт","43.00","",""
"","ФР-00006987","54813-4E400","548134E000","GEUN YOUNG KOREA","Втулка стабилизатора переднего Bongo 3, GEUN YOUNG KOREA","48.000","шт","31.00","",""
"","ФР-00008484","54631-47000","54631-47000","MBS","Втулка стойки подвески Bongo 3, MBS","4.000","шт","193.00","",""
"","ФР-00007325","0S083-34136A","CRK006","CARDEX KOREA","Втулка тяги реактивной K2500/K2700, CARDEX KOREA","6.000","шт","35.00","",""
"","ФР-00001014","43254-25000","43254-25000","MBS KOREA","Втулка шестерни МКПП 1-й передачи Porter 2, MBS KOREA","1.000","шт","190.00","",""
"","ФР-00007509","37300-4A700","TT12560","TESLA TECHNICS","Генератор Porter 2/Bongo 3, TESLA TECHNICS","1.000","шт","9025.00","",""
"","ФР-00008552","37300-4A700","37300-4A700","MBS KOREA","Генератор Porter 2/Bongo 3, MBS KOREA","1.000","шт","12635.00","",""
"","00000002227","96420-4A600","96420-4A600","MBS KOREA","Датчик скорости D4CB Porter 2, MBS KOREA","2.000","шт","1045.00","",""
"","ФР-00001690","39220-38030","39220-38030","MBS","Датчик температуры охлаждающей жидкости D4CB Porter 2, MBS","1.000","шт","608.00","",""
"","00000003266","76004-4F010","76004-4F010","MBS KOREA","Дверь правая Porter 2, MBS KOREA","1.000","шт","9500.00","",""
"","00000002596","52910-4F000","52910-4F000","MBS KOREA","Диск колеса R12 Porter 2, MBS KOREA","1.000","шт","2375.00","",""
"","ФР-00000080","52910-4F230","52910-4F230","MBS","Диск колеса R13 Porter 2, MBS","1.000","шт","3135.00","",""
"","00000002179","52910-4F230","52910-4F230","MBS KOREA","Диск колеса R13 Porter 2, MBS KOREA","1.000","шт","3135.00","",""
"","00000002597","52910-4F300","52910-4F300","MBS KOREA","Диск колеса R15 Porter 2, MBS KOREA","4.000","шт","2375.00","",""
"","ФР-00002443","41100-4D030","VKD35943","VALEO KOREA","Диск сцепления (-12) 5MT Porter 2/Bongo 3, VALEO KOREA","65.000","шт","3278.00","",""
"","ФР-00007535","41100-47200","43976","VALEO KOREA","Диск сцепления D4CB (12-) 6MT Porter 2/Bongo 3, VALEO KOREA","6.000","шт","3325.00","",""
"","00000002472","51712-4F000","R1018","VALEO","Диск тормозной передний Porter 2, VALEO","1.000","шт","1283.00","",""
"","00000003108","51712-4F000","R1018","VALEO KOREA","Диск тормозной передний Porter 2, VALEO KOREA","27.000","шт","1283.00","",""
"","00000002621","81905-4FC41","81905-4FC41","MBS KOREA","Замки (личинки) с ключами Porter 2, MBS KOREA","1.000","компл.","2660.00","",""
"","00000001817","81905-4FA50","81905-4FA50","MBS KOREA","Замки (личинки) с ключами Porter 2, MBS KOREA","3.000","шт","1900.00","",""
"","ФР-00002108","87620-4F400CA","87620-4F400CA","MBS","Зеркало правое Porter 2, MBS","2.000","шт","2565.00","",""
"","00000005335","66400-4E510","66400-4E510","MBS","Капот Bongo 3, MBS","1.000","шт","3984.00","",""
"","00000004222","66400-4E000","66400-4E000","MBS","Капот Bongo 3, MBS","1.000","шт","2896.00","",""
"","ФР-00006907","0K551-12111","0K551-12111","ANJUN KOREA","Клапан впускной Bongo 3, ANJUN KOREA","6.000","шт","181.00","",""
"","ФР-00006944","22211-4A061","222114A061","ANJUN KOREA","Клапан впускной D4CB Porter 2, ANJUN KOREA","28.000","шт","314.00","",""
"","ФР-00006948","22212-4A061","22212-4A061","ANJUN KOREA","Клапан выпускной D4CB Porter 2, ANJUN KOREA","42.000","шт","352.00","",""
"","00000001591","22212-4A061","22212-4A061","MBS KOREA","Клапан выпускной D4CB Porter 2, MBS KOREA","34.000","шт","475.00","",""
"","ФР-00006742","22212-4A061","222124A061","ANJUN","Клапан выпускной D4CB Porter 2, ANJUN","8.000","шт","352.00","",""
"","ФР-00002677","25350-4E400","25350-4E400","MBS","Кожух вентилятора Bongo 3, MBS","1.000","шт","708.00","",""
"","ФР-00004788","00662-33049","00662-33049","MBS","Кожух гайки передней ступицы Bongo 3, MBS","1.000","шт","14.00","",""
"","ФР-00005735","58305-4FA00","CR583054FA00","CR","Колодки тормозные барабанные задние Porter 2/K2500/Bongo 3, CR","387.000","компл.","760.00","",""
"","ФР-00009295","58101-4EB01","PKB018","PARTS MALL","Колодки тормозные передние (4шт.) Bongo 3, PARTS MALL","1.000","компл.","1729.00","",""
"","ФР-00005737","58101-4EA00","CR581014EA00","CR","Колодки тормозные передние (4шт.) Bongo 3, CR","340.000","компл.","523.00","",""
"","ФР-00004685","0K60A-3328ZA","SPK3185","SPK KOREA","Колодки тормозные передние (4шт.) K2500/K2700/Bongo 3, SPK KOREA","8.000","компл.","713.00","",""
"","ФР-00005736","58101-4FA00","CR581014FA00","CR","Колодки тормозные передние Porter 2 CR, CR","22.000","компл.","589.00","",""
"","ФР-00005767","58101-4FA00","CR581014FA00","CR","Колодки тормозные передние Porter 2 CR, CR","241.000","компл.","589.00","",""
"","ФР-00005497","0S083-33071A","0S083-33071A","MBS","Колпак ступицы колеса передней Bongo 3, MBS","1.000","шт","38.00","",""
"","00000002743","22224-4A000","22224-4A000","MBS","Колпачок маслосъёмный D4CB Porter 2/Grand Starex, MBS","8.000","шт","72.00","",""
"","ФР-00007072","23040-4Z900","230404Z900","YPR KOREA","Кольца поршневые d+0.00 Bongo 3, YPR KOREA","5.000","компл.","3420.00","",""
"","00000001064","23040-4A910","23040-4A910","MBS KOREA","Кольца поршневые D4CB Porter 2, MBS KOREA","2.000","компл.","5320.00","",""
"","ФР-00001307","23040-4A910","230404A910","YPR KOREA","Кольца поршневые D4CB Porter 2, YPR KOREA","1.000","компл.","4655.00","",""
"","ФР-00003999","43284-25047","43284-25047","MBS KOREA","Кольцо КПП стопорное Porter/Porter 2, MBS KOREA","1.000","шт","38.00","",""
"","ФР-00004007","43306-4D500","43306-4D500","MBS KOREA","Кольцо синхронизатора задней передачи Porter 2, MBS KOREA","1.000","шт","570.00","",""
"","ФР-00003348","43284-4D000","43284-4D000","MBS KOREA","Кольцо стопорное КПП Porter 2, MBS KOREA","1.000","шт","48.00","",""
"","00000002648","33805-4A000","33805-4A000","MBS","Кольцо уплотнительное форсунки топливной D4CB Porter 2, MBS","94.000","шт","66.00","",""
"","ФР-00001860","41300-4D000","VKD31487","VALEO KOREA","Корзина сцепления D4CB (-12) 5MT Porter 2/Bongo 3, VALEO KOREA","43.000","шт","2850.00","",""
"","00000002211","86539-4F000","86539-4F000","MBS KOREA","Кронштейн бамера центральный Porter 2, MBS KOREA","1.000","шт","22.00","",""
"","ФР-00007930","66310-4F400","66310-4F400","MBS","Крыло левое Porter 2 , MBS","1.000","шт","820.00","",""
"","00000001525","66320-4F000","66320-4F000","MBS KOREA","Крыло правое Porter 2, MBS KOREA","1.000","шт","1093.00","",""
"","00000002533","25261-42920","25261-42920","MBS KOREA","Крыльчатка вентилятора D4CB Porter 2, MBS KOREA","3.000","шт","1425.00","",""
"","ФР-00008548","31010-4EA10","31010-4EA10","MBS KOREA","Крышка бака топливного (с ключами) Bongo 3, MBS KOREA","1.000","шт","760.00","",""
"","ФР-00002646","31010-4FA10","310104FA10","OEM KOREA","Крышка топливной горловины с ключами Porter 2, OEM KOREA","20.000","шт","475.00","",""
"","ФР-00004312","H27 12V PGJ13","881","OSRAM","Лампа H27 12V PGJ13 (""г""-образный цоколь) Porter 2, OSRAM","2.000","шт","219.00","",""
"","ФР-00004311","H27 12V 27W PG13","880","OSRAM","Лампа H27/1W 12V PG13 (прямой цоколь) Porter 2, OSRAM","3.000","шт","190.00","",""
"","ФР-00005961","55113-4F000","CR551134F000","CR","Лист рессоры №3 Porter 2/Starex CR, CR","237.000","шт","808.00","",""
"","ФР-00004024","55111-4F000","CR551114F000","CR","Лист рессоры коренной Porter 2/Starex CR, CR","161.000","шт","1615.00","",""
"","ФР-00004025","55112-4F000","CR551124F000","CR","Лист рессоры подкоренной Porter 2/Starex CR, CR","17.000","шт","998.00","",""
"","00000001109","82404-4F010","82404-4F010","MBS KOREA","Механизм стеклоподъемника двери правой D4CB Porter 2, MBS KOREA","2.000","шт","475.00","",""
"","00000003169","81320-4F030","81320-4F030","MBS","Механизма замка двери правой Porter 2, MBS","1.000","шт","760.00","",""
"","ФР-00007476","25237-4A100","25237-4A100","MBS","Муфта вентилятора D4CB Porter 2, MBS","1.000","шт","3705.00","",""
"","ФР-00007322","0K710-32240","CEKK4","CTR KOREA","Наконечник рулевой K2500, CTR KOREA","7.000","шт","456.00","",""
"","ФР-00007960","56820-47500","YEH-36","GEUN YOUNG KOREA","Наконечник рулевой Porter 2, GEUN YOUNG KOREA","43.000","шт","333.00","",""
"","ФР-00005655","56820-47500","YEH-36","YULIMTECH KOREA","Наконечник рулевой Porter 2, YULIMTECH KOREA","7.000","шт","333.00","",""
"","ФР-00007125","58161-4F000","58161-4F000","MBS","Направляющая суппорта верхняя Porter 2/Bongo 3, MBS","18.000","шт","143.00","",""
"","ФР-00007126","58162-4F000","58162-4F000","MBS","Направляющая суппорта нижняя Porter 2/Bongo 3, MBS","5.000","шт","132.00","",""
"","ФР-00004702","25100-4A300","WP5058","VALEO KOREA","Насос СОД D4CB Porter 2, VALEO KOREA","21.000","шт","1995.00","",""
"","ФР-00011714","24380-4A100","24380-4A100","MBS","Натяжитель цепи ГРМ D4CB Porter 2/Starex/H-1, MBS","1.000","шт","3325.00","",""
